,created,handle,text,tweet_id
790,Sat Jul 08 11:00:41 +0000 2017,Fendi,#LeonettaLucianoFendi and @DelfDelettrez attending the #FendiHauteFourrure show in Paris! https://t.co/Z2UoRW3E9Z,883641986955214848
791,Sat Jul 08 08:38:19 +0000 2017,Fendi,"Behind the scenes is where all the magic happens, join us for a close-up of #FendiHauteFourrure, Flowers From Another World! https://t.co/tabLZT60Zq",883606157440536576
792,Fri Jul 07 19:02:02 +0000 2017,Fendi,First row guests @anyaziourova @helenabordon @carovreeland looking #Fendi - glamourous for the #FendiHauteFourrure show in Paris. https://t.co/P57aWtsHCr,883400732329730052
793,Fri Jul 07 14:01:09 +0000 2017,Fendi,.@OliviaPalermo turns heads in #FendiResort18 and #FendiCanEye sunnies at the #FendiHauteFourrure show in Paris. Photo by Vincenzo Grillo https://t.co/ulpVra4gPi,883325014715629568
794,Fri Jul 07 12:23:41 +0000 2017,Fendi,"Effortlessly flawless in #FendiFW17, @ChiaraFerragni makes her entrance at the #FendiHauteFourrure show in Paris. Photo by Vincenzo Grillo https://t.co/u5sTT0Z0LB",883300485809262593
795,Fri Jul 07 08:00:29 +0000 2017,Fendi,"Runway-ready, just moments before the #FendiHauteFourrure Collection, by #KarlLagerfeld and #SilviaVenturiniFendi makes its debut! https://t.co/uJRqIY6Krp",883234250253881345
796,Thu Jul 06 21:03:18 +0000 2017,Fendi,"Ethereal beauty emerged for the finale of #FendiHauteFourrure, Flowers From Another World by #KarlLagerfeld and #SilviaVenturiniFendi https://t.co/j9wgO0pKZO",883068865126825987
797,Thu Jul 06 18:01:07 +0000 2017,Fendi,A verdant  garden of Flowers From Another World in detail. Created by #KarlLagerfeld and #SilviaVenturiniFendi #FendiHauteFourrure https://t.co/1AovgKaXEL,883023015407235073
798,Thu Jul 06 15:50:49 +0000 2017,Fendi,Soft landscapes of floral paintings walked the runway - the #FendiHauteFourrure Collection by #KarlLagerfeld and #SilviaVeturiniFendi https://t.co/IoxOhrsN6M,882990223839330304
799,Thu Jul 06 08:04:11 +0000 2017,Fendi,Flowers From Another World  bloomed on the runway - the #FendiHauteFourrure Collection designed by #KarlLagerfeld and #SilviaVenturiniFendi https://t.co/HoiYUYTNZr,882872793091756032
800,Wed Jul 05 15:59:47 +0000 2017,Fendi,The #FendiHauteFourrure Collection is all about the unique details! Watch the show LIVE tonight at 8.30 CET on https://t.co/dxECfMdZz1 https://t.co/SjqFKHGyzR,882630094208086020
801,Wed Jul 05 10:37:33 +0000 2017,Fendi,Fendi's got your ticket to the runway -  watch the unveil of #FendiHauteFourrure LIVE tonight at 8.30pm CET on https://t.co/dxECfMdZz1 https://t.co/Sk9O1QfJul,882549002511712256
802,Tue Jul 04 18:14:41 +0000 2017,Fendi,The restlessly inventive Fendi team is working on the final touches of the #FendiHauteFourrure Collection that debuts on July 5th in Paris! https://t.co/v8yfjYHR6e,882301654493798400
803,Tue Jul 04 13:25:25 +0000 2017,Fendi,One day left to the show! The #FendiHauteFourrure Collection is in full bloom - watch live on 5th of July on https://t.co/LPxAHLEljy https://t.co/NGsDVtrDGl,882228857910243329
804,Mon Jul 03 17:19:39 +0000 2017,Fendi,It's that time of the year and the #FendiHauteFourrure Collection will soon be launched in #Paris! Watch live on https://t.co/LPxAHLEljy https://t.co/40hNzHrN3F,881925416667275273
805,Mon Jul 03 12:22:57 +0000 2017,Fendi,Dreams of summer in the Riviera. @bellahadid is fairy-tale like beauty in #FendiFW17 for @InStyle Photography by Kacper Kasprzyk https://t.co/CkHO2wDIYs,881850750900609024
806,Sun Jul 02 17:44:46 +0000 2017,Fendi,Always by your side: the iconic #FendiPeekaboo from #FendiPreFall17. Adorn yours on https://t.co/dxECfMdZz1 https://t.co/sGuyOYMvmE,881569351702282240
807,Sun Jul 02 08:53:29 +0000 2017,Fendi,The classic black leather jacket gets a floral update. Pick yours from #FendiPreFall17 on https://t.co/LPxAHLEljy https://t.co/DEE0aNCOxV,881435646782574592
808,Sat Jul 01 18:00:23 +0000 2017,Fendi,"Kiki Boreel takes the spotlight in a striped crop top from #FendiSS17 for @Grazia, June 17. https://t.co/T0anH6QwC1",881210892855259136
809,Sat Jul 01 10:00:03 +0000 2017,Fendi,Summer is in full swing! We are weekend-ready for the beach with super-stylish sunnies! #FendiCanEye spotted in @andctweet https://t.co/1gmhPcmIAW,881090011613065216
810,Fri Jun 30 20:26:04 +0000 2017,Fendi,A hint of the inspiration behind the powerful Fendi Vocabulary. Men's #FendiFW17 now on https://t.co/LPxAHLVWb6 https://t.co/uPwOJC0Lfb,880885168101236736
811,Fri Jun 30 16:23:06 +0000 2017,Fendi,"Stripes and texture, on the fun. See more from the men's #FendiFW17 collection on https://t.co/LPxAHLEljy https://t.co/tqMdmQBoQe",880824023327834112
812,Fri Jun 30 14:49:12 +0000 2017,Fendi,Spotted: a #NaomiWatts with a #FendiKanI in shimmering metallic leather with floral accents! Find yours on https://t.co/LPxAHLEljy. https://t.co/b3JUao88aI,880800390400397313
813,Fri Jun 30 11:00:50 +0000 2017,Fendi,Share the love! #FendiFW17 expresses the fresh Fendi Vocabulary with a new level of optimism. https://t.co/nwLu3zYUem,880742919443021825
814,Thu Jun 29 20:16:07 +0000 2017,Fendi,".@Realtaeyang is such a bae in #FendiFW17 #YoungBae for Elle Men Hong Kong, July 17 #FendixYoungBae https://t.co/Pu2hhbPlUO",880520275728715777
815,Thu Jun 29 15:16:01 +0000 2017,Fendi,The #FendixYoungBae Capsule Collection available in HK on July 27 blends the magic of Fendi&amp;the style of talented #YoungBae @Realtaeyang https://t.co/QX2j1iGCPi,880444752675696641
816,Thu Jun 29 10:50:23 +0000 2017,Fendi,"A fierce, fabulous vision in red! @bellahadid in #FendiFW17 on the cover of @InStyle Photography by Kacper Kasprzyk https://t.co/Ex4NsXd4zx",880377902872899584
817,Wed Jun 28 17:08:03 +0000 2017,Fendi,The geometric prints of #FendiPreFall17 combine a down-to-earth edge with a pinch of high-class elegance. @DavikaH at #shanghaifilmfestival https://t.co/mlrrLO6FaB,880110557906579456
818,Wed Jun 28 12:47:56 +0000 2017,Fendi,Essentials: Fendi and Pizza. @ChiaraFerragni in #FendiFW17 for @papermagazine https://t.co/cegNN8l06K,880045096896299008
819,Tue Jun 27 20:00:58 +0000 2017,Fendi,Shades of cool from #FendiFW17 Men's Collection. Pick yours on https://t.co/LPxAHLEljy https://t.co/Mg7eqSGaIT,879791686372782081
820,Tue Jun 27 17:01:01 +0000 2017,Fendi,"Palazzo Fendi in Rome gets an oh-so-chic makeover with the latest #FendiPreFall17 collection! Go on and indulge, we won't tell. https://t.co/7Ndy0dRzLz",879746399583297536
821,Tue Jun 27 13:42:57 +0000 2017,Fendi,A #FendiKanI adorned with charms that make it yours! Shop #FendiPreFall17 on https://t.co/dxECfMdZz1 https://t.co/u8bZR5fzFr,879696554751340544
822,Mon Jun 26 20:05:06 +0000 2017,Fendi,Monday mood. @KendallJenner in #FendiFW17 for @VogueOfficialUS by @theo_wenner https://t.co/OOP2dBWXEJ,879430339218866176
823,Mon Jun 26 17:46:25 +0000 2017,Fendi,"Stylish shades on sun-soaked days signal the sound of vacation. #FendiCanEye spotted in @cosmokorea May, 17. https://t.co/aNuPewCtmp",879395436372647937
824,Mon Jun 26 13:01:19 +0000 2017,Fendi,Mondays are for comfy loafers that will take you through the day! #FendiPreFall17 https://t.co/2LM92vcqRJ,879323692416856064
825,Sun Jun 25 21:11:01 +0000 2017,Fendi,Windowshopping satisfies the strongest fashion cravings and #FendiPreFall17 is ever-so-tempting! Now in #Fendi boutiques across the globe. https://t.co/FiATkFg7Gy,879084539888496641
826,Sun Jun 25 14:00:01 +0000 2017,Fendi,The only match for the crafty details of the #FendiRockoko booties is the elegance of a #FendiPreFall17 dress. @DavikaH for @DichanMagazine https://t.co/Ln0LqeJveR,878976076525031425
827,Sun Jun 25 07:00:18 +0000 2017,Fendi,Darkly romantic with Fall floral motifs in bloom. Get inspired from #FendiPreFall17 on https://t.co/LPxAHLEljy #FendiKanI https://t.co/NOKIi5vfTi,878870449412874240
828,Sat Jun 24 19:06:57 +0000 2017,Fendi,"Stylish Fendi Timepieces with the new Strap You interchangeable straps, give your wrist that wow effect! #FendiTimepieces https://t.co/CHrjRJ1A8g",878690929384837120
829,Sat Jun 24 18:00:43 +0000 2017,Fendi,Earthly colours with a metallic sheen are the preferred pallette of #FendiPreFall17. Pick your new fave on https://t.co/LPxAHLEljy https://t.co/iAmSloX5yA,878674262021853186
830,Sat Jun 24 02:03:24 +0000 2017,Fendi,"#SilviaVenturiniFendi &amp; @realtaeyang collab to create #FendixYoungBae capsule collection, launching July 27 in Hong Kong! #YoungBae https://t.co/uAwAXTd8iZ",878433344324866048
831,Fri Jun 23 19:03:02 +0000 2017,Fendi,New collab coming up - the #FendixYoungBae Capsule Collection will be available in Hong Kong from July 27th! @Realtaeyang #YoungBae https://t.co/WkH9xctSSL,878327554943311876
832,Fri Jun 23 13:19:00 +0000 2017,Fendi,The new #FendixYoungBae Capsule Collection - fusing signature styles and common philosphies #YoungBae #FendiFW17 https://t.co/d8c6MjbnCb,878240976816525313
833,Fri Jun 23 08:00:05 +0000 2017,Fendi,#FendiFW17 Men's pops up at @DoverStMarket London! Visit now thru July 9 &amp; shop the limited edition capsule collection - LOVE. #FendiDSM https://t.co/aG2U6zejcp,878160718801096704
834,Thu Jun 22 16:31:20 +0000 2017,Fendi,"Visit our new menswear pop-up at @DoverStMarket in London + shop the limited edition Fendi Vocabulary ""LOVE"" capsule collection. #FendiDSM https://t.co/C5mpvTBpfO",877926989344022528
835,Wed Jun 21 20:00:30 +0000 2017,Fendi,Creative details from the #FendiSS18 Men's Collection designed by #SilviaVenturiniFendi #MFW https://t.co/e24EANjjgc,877617243785482241
836,Wed Jun 21 16:00:56 +0000 2017,Fendi,A reversible bag to carry the weight of the weekend - from #FendiSS18 Men's Collection designed by #SilviaVenturiniFendi #MFW https://t.co/XsrbmBZUdx,877556953437884416
837,Wed Jun 21 13:27:22 +0000 2017,Fendi,The finale of #FendiSS18 Men's Collection designed by #SilviaVenturiniFendi https://t.co/XYIg5YuMA7,877518306407841794
838,Tue Jun 20 11:51:06 +0000 2017,Fendi,"We honor our dear Carla, whose loss deeply affects us all. https://t.co/qRMIfcVXs7",877131693378998272
839,Mon Jun 19 21:00:46 +0000 2017,Fendi,When the invitation says executive realness on the verge of the weekend. #FendiSS18 Men's Collection designed by #SilviaVenturiniFendi https://t.co/0tpHsBfetg,876907631318900736
840,Mon Jun 19 18:14:01 +0000 2017,Fendi,Corporate aplomb with a hint of vacation. #FendiSS18 Men's Collection designed by #SilviaVenturiniFendi #MFW https://t.co/Xa3sxWqLHK,876865669110824960
841,Mon Jun 19 15:54:02 +0000 2017,Fendi,"In case you missed it, the new #FendiSS18 Men's Collection designed by #SilviaVenturiniFendi debuted on the runway today! #MFW https://t.co/oeroE6234J",876830441935863808
842,Mon Jun 19 10:37:53 +0000 2017,Fendi,You're invited! Watch LIVE today on https://t.co/LPxAHLEljy at 2pm CET to get the first glimpse of the new #FendiSS18 Men's collection! https://t.co/73ePazsFvi,876750880837644289
843,Sun Jun 18 18:40:43 +0000 2017,Fendi,Only creative vibes at #Fendi in Milan today. We're almost set for the #FendiSS18 Men's debut! #SilviaVenturiniFendi #MFW https://t.co/UTNzQgZGwP,876510000520323073
844,Sun Jun 18 09:18:22 +0000 2017,Fendi,Just about runway-ready! The #FendiSS18 Men's collection launches on Monday June 19th at 2pm CET. Watch live on https://t.co/LPxAHLEljy! https://t.co/ulZhIeeV4Z,876368481532473344
845,Sat Jun 17 18:29:40 +0000 2017,Fendi,"Getting ready for the Men's #FendiSS18 show, hitting the catwalk on Monday June 19th at 2pm CET. Watch live on https://t.co/LPxAHLEljy! https://t.co/EVe4u52TTM",876144833517293573
846,Sat Jun 17 15:17:27 +0000 2017,Fendi,It's all happening! #FendiSS18 Men's hits the runway on Monday June 19th. We're taking you backstage to see all the details. #MFW https://t.co/2hK4BsTIk7,876096458537267201
847,Sat Jun 17 09:07:02 +0000 2017,Fendi,Saturdays in pastel #FendiRockoko booties and pretty pink stripes. Nathalie Nyren in #FendiSS17 by @danielarettore for @ELLE_Kazakhstan https://t.co/1i00mcLYvM,876003240369946626
848,Fri Jun 16 22:02:40 +0000 2017,Fendi,.@PokrasLampas gets ultra-creative with modern calligraphy on the #FendiHQ rooftop. See more on @fisforfendi and https://t.co/UyF6y85ikv https://t.co/cxGH19jAoS,875836047913037824
849,Fri Jun 16 12:45:55 +0000 2017,Fendi,When your necklace game is on fleek with Fendi #ABClick charms @DavikaH in #FendiPreFall17 for @DichanMagazine https://t.co/AbjwhakGrL,875695936822968320
850,Thu Jun 15 19:34:05 +0000 2017,Fendi,Lady in red! Actress @svevaalviti crushes it in crimson in #FendiFW17 at “Les nuits en Or 2017” Gala dinner in Paris. https://t.co/eBbYnP3xw2,875436266724216836
851,Thu Jun 15 13:16:38 +0000 2017,Fendi,#TildaSwinton's glacial beauty meets fiery Fendi prints. Spotted in #FendiFW17 at the Okja Film screening in Seoul. https://t.co/3DF7bUNFvJ,875341277797265408
852,Wed Jun 14 16:00:08 +0000 2017,Fendi,"#Suzy&amp;her personalized mini #FendiPeekaboo illustration created by @jaesukkim_ at the #FendiGalleria opening in Seoul, South Korea https://t.co/Xa3UiDFTAW",875020038637584384
853,Wed Jun 14 12:25:32 +0000 2017,Fendi,The #FendiGalleria opening in Seoul was blooming with creativity! Here’s @ireneisgood loving her #FendiPeekaboo illustration by @jaesukkim_ https://t.co/bDAAvD1rR1,874966031403560961
854,Tue Jun 13 18:34:09 +0000 2017,Fendi,"The reveal is in the details and choosing isn’t easy. @skuukzky in #FendiPreFall17 at the #FendiGalleria opening in Seoul, South Korea https://t.co/i9IGtpIyGF",874696406803632129
855,Tue Jun 13 13:33:22 +0000 2017,Fendi,"When florals, daring colors &amp; the #FendiGalleria opening collide, @ireneisgood comes out to play in the latest #FendiPreFall17 https://t.co/o45K6cnnIc",874620714929860608
856,Mon Jun 12 17:37:26 +0000 2017,Fendi,"There's a new E-comm site that sells happiness, including Fendi's iconic Peekaboo. Say hello to @24Sevres ! #FendiPeekaboo https://t.co/SFwAtKCDCB",874319749324439552
857,Mon Jun 12 11:58:02 +0000 2017,Fendi,This charm-ing bag! Add a #FendiABClick charm to your favorite Fendi bag. Check out #FendiPreFall17 on https://t.co/LPxAHLEljy https://t.co/QWw3yLLNur,874234334567444482
858,Sun Jun 11 12:47:01 +0000 2017,Fendi,"Kiki Willems embodies the essence of garden party glam in #FendiSS17, by Camilla Akrans in Vogue China, June 17 https://t.co/hn81qCKYFi",873884274839228416
859,Sat Jun 10 16:00:51 +0000 2017,Fendi,Cutouts with sun-kissed skin will always spell summer. @veronikakunz in #FendiSS17 by @ansgar_sollmann for @annabelle_mag https://t.co/6Cus8n0CDA,873570665227571200
860,Fri Jun 09 20:18:38 +0000 2017,Fendi,"Orchids on a white canvas, a one of a kind Peekaboo customised by talented presentor #LanYang for the #FendiPeekabooProject https://t.co/f3DdM57oJZ",873273153090461696
861,Fri Jun 09 17:30:24 +0000 2017,Fendi,A #FendiPeekaboo that celebrates the deep blue. Customised by diver #GuoJingjing for the #FendiPeekabooProject https://t.co/KPhtjCaLXy,873230815202869250
862,Fri Jun 09 14:33:20 +0000 2017,Fendi,Beautiful actress #Angelababy and her uniquely customised Fendi Peekaboo as part of the #FendiPeekabooProject https://t.co/I78sCunzYI,873186253415514112
863,Fri Jun 09 08:26:17 +0000 2017,Fendi,"#TimmyXu is LIVE on https://t.co/LPxAHLVWb6 to celebrate The China Peekaboo Project, with proceeds to benefit six charities. https://t.co/SaMg0LyIdR",873093882472407040
864,Thu Jun 08 18:26:08 +0000 2017,Fendi,Head-to-toe sunshine yellow meets fearless femininity &amp; pure joie de vivre on Miriam Leone in #FendiResort18 at the #McKimMedalGala https://t.co/9DBKtXiBiB,872882452984979456
865,Thu Jun 08 12:00:51 +0000 2017,Fendi,"We're having a fun pastel party in color-coordinated #FendiKids mini-dresses.
via @fannicefashion by Ariana Curro #FendiMiniMe https://t.co/qIjzYbpyP4",872785493456506881
866,Wed Jun 07 18:30:10 +0000 2017,Fendi,"For summer chic &amp; beachside posing, start with pops of fiery red! #FendiSS17 
@robinmarjolein_  in @CosmopolitanDE, photo by @tomasdlfuente https://t.co/mWWHZB7Puu",872521076793892864
867,Wed Jun 07 12:16:35 +0000 2017,Fendi,.@bellahadid is a classic glamour dream in Fendi. Spotted in @vogue_italia by Inez van Lamsweerde &amp; Vinoodh Matadin https://t.co/jyX6Tn5BYn,872427061889118212
868,Tue Jun 06 18:04:03 +0000 2017,Fendi,"Sugar - coat your style with daring pink and these #FendiRockoko booties! Spotted in Vogue Accessory, Spring 17. https://t.co/oWAIoJWuel",872152118538510336
869,Tue Jun 06 13:38:08 +0000 2017,Fendi,"This summer's inventory: A #FendiSS17 sheer dress and little else 
@xeniatchoumi Pick yours on https://t.co/dxECfMdZz1 https://t.co/ayjT1bxWn1",872085197826785281
870,Mon Jun 05 18:12:11 +0000 2017,Fendi,".@JosephinSkriver is urban-cool sporting #FendiSS17 in Turkey's Harper Bazaar, June 2017 📸 by Jack Waterlot https://t.co/RujP9cS5XG",871791778575331328
871,Mon Jun 05 14:23:54 +0000 2017,Fendi,Monday calls for fun flowery glamour with a mini #FendiPeekaboo that will lift up your mood instantly #FendiPreFall17 Photo by @purseblog https://t.co/oZLJvJeux1,871734329831018496
872,Sun Jun 04 16:31:54 +0000 2017,Fendi,.@NicoleKidman scored a style-point with a #FendiKanI to top off her #FendixVeuveClicquot look at the #VCPoloClassic! https://t.co/1C1CT0P1mz,871404151414116353
873,Sun Jun 04 01:18:54 +0000 2017,Fendi,More #FendixVeuveClicquot style inspiration from this year's #VCPoloClassic! @cocorocha @Natalieoffduty https://t.co/wigpCKpDIG,871174390393843713
874,Sat Jun 03 20:54:50 +0000 2017,Fendi,.@cocorocha takes over #Snapchat today at the 10th #VCPoloClassic! Check out the #FendixVeuveClicqout bag charm on https://t.co/LPxAHLEljy https://t.co/Akm5I7ufmR,871107933194653697
875,Fri Jun 02 18:00:08 +0000 2017,Fendi,It's the last day of the #TapYouStrapYou interactive play - be sure to tap tap on #Snapchat &amp; Instagram Stories for more Fendi fun! https://t.co/8JLbL1roD5,870701582567882752
876,Fri Jun 02 17:03:50 +0000 2017,Fendi,Celebrate the 10th annual #VCPoloClassic with a #FendixVeuveClicquot bag charm &amp; style guide on https://t.co/LPxAHLVWb6 https://t.co/K3k7BHtoOb,870687414691348481
877,Fri Jun 02 12:00:06 +0000 2017,Fendi,The @MonacoGPrix calls for delicate floor-sweeping dresses and the latest accessories from Fendi #FendiSS17 #FendiPreFall17 @tmaxovaofficial https://t.co/7UkKEJAIYP,870610977284337664
878,Thu Jun 01 18:30:15 +0000 2017,Fendi,Tap into your playful side with #TapYouStrapYou on #Snapchat &amp; Instagram Stories today and dig in for that #FendiKanI! https://t.co/72U9p2mntm,870346772777926657
879,Thu Jun 01 12:07:08 +0000 2017,Fendi,"Take on the retro prints this season, defying the bounds of time &amp; space. #FendiPreFall17 in @tankmagazine, by Sohrab Golsorkhi-Ainslie https://t.co/uSXZqTq5Ej",870250359981297666
880,Wed May 31 19:00:13 +0000 2017,Fendi,Fendi loves fun! Check #Snapchat &amp; Instagram Stories again to play the #TapYouStrapYou game - which Strap You did you tap into? https://t.co/GucHLsXsSI,869991925537001473
881,Wed May 31 10:46:37 +0000 2017,Fendi,The sweet-but-not sugary retro inspired #FendiCanEye are essential for the sun-soaked days ahead. Pick yours on https://t.co/LPxAHLEljy https://t.co/gyHR2LUBWh,869867705532395521
882,Tue May 30 17:42:28 +0000 2017,Fendi,"Release your inner Juliet, whether you’ve got a Romeo or not! This #FendiPreFall17 look is oh-so-romantic. More on https://t.co/LPxAHLEljy https://t.co/6uGh86BGAg",869609973537550336
883,Tue May 30 15:31:45 +0000 2017,Fendi,Are you ready to play #TapYouStrapYou? Tap in Fendi's Instagram Stories &amp; Snapchat to see which #FendiPreFall designs appear! https://t.co/bpkOe2Lzy1,869577076256460800
884,Mon May 29 20:19:59 +0000 2017,Fendi,Tomorrow be sure to tap tap #Snapchat &amp; Instagram Stories to pop the balloons &amp; see the latest from #FendiPreFall17 appear. #TapYouStrapYou https://t.co/evQnIPHBTY,869287226147995648
885,Mon May 29 14:28:48 +0000 2017,Fendi,It's a new week and we're ready to put our best foot forward. The new knit #FendiRockoko boots - #FendiPreFall17 on https://t.co/LPxAHLEljy https://t.co/sRalZVPILH,869198848123711492
886,Sun May 28 19:29:05 +0000 2017,Fendi,Indulge yourself in Sunday pleasures. Pick your favorite #FendiKanI and charm it up on https://t.co/dxECfMdZz1 https://t.co/RJg6mWZ3nA,868912025451343873
887,Sun May 28 12:09:08 +0000 2017,Fendi,"Pump up the pink! @ChiaraFerragni's wearing the finest knitted #FendiRockoko from #FendiSS17, in Glamour Mexico, May, 17 by Frankie Batista https://t.co/wycTQpToQ5",868801310832898049
888,Sat May 27 19:10:03 +0000 2017,Fendi,"How can you resist this cute #fendichick charm? No, you can't. Pick your favorite on https://t.co/dxECfMdZz1 Illustration by @loulofficiel https://t.co/oDDrptFz5h",868544850278445057
889,Sat May 27 12:25:03 +0000 2017,Fendi,Rising star @skaijackson shines in Fendi summer florals for @TheCut by Jessie English #FendiSS17 https://t.co/RHg7Va4jqV,868442927118376961
890,Fri May 26 22:11:21 +0000 2017,Fendi,The #FendiPreFall17 luxe garden is blooming! Pick the prettiest bunch on https://t.co/LPxAHLEljy https://t.co/zV0lZUVMnM,868228087758147584
891,Fri May 26 14:50:11 +0000 2017,Fendi,"From 1997-2017 and on, the #FendiBaguette has been the It-Bag. Share your favorite design and see the latest on https://t.co/LPxAHLEljy https://t.co/YBm0KL0Mj2",868117064405442561
892,Thu May 25 17:17:13 +0000 2017,Fendi,"Twenty years later, the ever-chic baguette is still a coveted classic sparkled with colourful rainbow studs #fendibaguette https://t.co/9dk4hKLF2T",867791677825572864
893,Thu May 25 12:51:42 +0000 2017,Fendi,Sporty spice and your everyday Fendi dose via @thehesstwins  More #fendilesurewear on https://t.co/dxECfMdZz1 https://t.co/SLGSXPQCfC,867724857466912768
894,Wed May 24 20:01:03 +0000 2017,Fendi,"Visit our new boutique at @KoP_Mall – near Philadelphia – to experience the latest Fendi magic, full of pops of colour &amp; creativity! https://t.co/T0zPzhELqM",867470520341737474
895,Wed May 24 11:16:35 +0000 2017,Fendi,"A coat to die for! Refined urban style on fleek from #FendiPreFall17, #FORDmodels' @__yourfavgirl  by @dariocatellani  for @tmagazine https://t.co/uMSHfsoCmj",867338534419673088
896,Tue May 23 14:49:49 +0000 2017,Fendi,"A stylish sailor on the run, ravishing @iza_goulart at the #70thCannesFilmFestival rocking a marine inspired #FendiKanI https://t.co/OlVZ6xPHTR",867029806776537089
897,Mon May 22 21:01:19 +0000 2017,Fendi,Foglie di Pietra (Leaves of Stone) - by #GiuseppePenone - a work of art for the special city of Rome. #FendixGPenone #FendiRoma https://t.co/VJHRtBz6mh,866760912795033602
898,Mon May 22 17:25:33 +0000 2017,Fendi,In just 30 min we unveil a new public artwork by #GiuseppePenone right in the historic center of our home - Rome! #FendixGPenone https://t.co/nvlpdBZtIC,866706609552191488
899,Mon May 22 15:40:13 +0000 2017,Fendi,A flawless look to conquer Mondays! #FendiPreFall17 by Jihad Hojeily for @AEMAGAZINE_ME https://t.co/Ah9OwVgokq,866680101714501633
900,Mon May 22 07:16:38 +0000 2017,Fendi,"Today we unveil a new art installation by #GiuseppePenone, supporting art and culture in the city of Rome. More to come! #FendixGPenone https://t.co/1mfziQKsFh",866553374094897153
901,Sun May 21 14:05:01 +0000 2017,Fendi,"For the perfect summer getaway: this #FendiSS17 dress, a glass of bubbles and dancing. https://t.co/zt46Ja7jQa",866293757599240193
902,Sat May 20 17:30:51 +0000 2017,Fendi,💋💋 @PixieLott in #FendiSS17 https://t.co/2j1AuEhxga,865983169039826949
903,Sat May 20 15:17:01 +0000 2017,Fendi,Multi-colored happy faces that pump up the weekend fun. Pick your favorite from #FendiPreFall17 https://t.co/ZAWEHwg4v3,865949489781133312
904,Fri May 19 19:09:16 +0000 2017,Fendi,Stop by the #FendiMatrice exhibit at #FendiHQ if you're in Rome this weekend! But note : it will be closed on Monday 5/22 just for the day. https://t.co/N4WorAMShJ,865645547306209280
905,Fri May 19 15:01:19 +0000 2017,Fendi,Loving the latest from #FendiPreFall17! Check out more on https://t.co/LPxAHLVWb6. https://t.co/W09ih57cOE,865583148591009793
906,Thu May 18 11:26:08 +0000 2017,Fendi,Airport style on fleek: @SvevaDaily on her way to the #70thCannesFilmFestival in the latest #FendiSS17 https://t.co/IYV3nnRcGU,865166608116920320
907,Wed May 17 13:40:54 +0000 2017,Fendi,".@Lupita_Nyango looks radiant in the latest #FendiFW17 get-up at the 'Can't Stop, Won't Stop: A Bad Boy Story' London screening https://t.co/7hykRzAoWd",864838135372533760
908,Tue May 16 12:36:05 +0000 2017,Fendi,Bella in blush! #FendiSS17 dress and #FendiRockoko boots featured in @IOdonna https://t.co/l1zdWQMTtP,864459438706577408
909,Mon May 15 20:50:00 +0000 2017,Fendi,The queen needs her crown 👑 @clairefoydaily looking royal in #FendiFW17 at the #BAFTAs. https://t.co/cR3NN6t6DQ,864221348725477376
910,Sun May 14 17:18:01 +0000 2017,Fendi,What to count on this spring: blush pinks and gold. The #FendiSS17 jacket spotted in @bonmagazine. https://t.co/2nG7Q0u2oM,863805614341992448
911,Sun May 14 09:22:02 +0000 2017,Fendi,"#MothersDay's wish revealed: classic with a pinch of rainbow, the wallet that holds all her essentials in one place. https://t.co/QOSonK4zkQ",863685829444677633
912,Sat May 13 16:45:02 +0000 2017,Fendi,"Let this #Fendilook do the talking, Saturdays are for pops of sun and hidden smiles. https://t.co/hgkZyHY0Jj",863434925395062786
913,Sat May 13 09:28:02 +0000 2017,Fendi,Summer essentials for an exotic getaway: sunkissed skin and this Fendi pop of red. #AirFranceMadame https://t.co/JxWTEh5ArI,863324949704052736
914,Fri May 12 20:27:07 +0000 2017,Fendi,The only blue we're feeling today is talented @MiriamLeoneFc 's full #FendiFW17 look. https://t.co/04H5immwgZ,863128424021458946
915,Fri May 12 17:25:01 +0000 2017,Fendi,The #Fendirumi were over the moon to have Silvia Venturini Fendi join the #FendiOmotesando fun in Tokyo! https://t.co/utRK6xYLx3,863082598402314241
916,Fri May 12 09:14:27 +0000 2017,Fendi,.@alisaueno is all smiles at the #FendiOmotesando event in Tokyo! #FendiSS17 https://t.co/DDxPWX45ru,862959145040977920
