,created,handle,text,tweet_id
0,Wed Mar 28 20:01:01 +0000 2018,Fendi,"Bold in design and easy to wear, discover the new 'I See You' selection from #FendiEyewear: https://t.co/RveoJcwx7U https://t.co/fbSpRylPtH",979085975631446016
1,Wed Mar 28 17:00:03 +0000 2018,Fendi,"Modern footwear with a surprising Fendi twist: https://t.co/C8jUWkgmPQ
#FendiSS18 https://t.co/wle0eoXJ1g",979040434491019264
2,Wed Mar 28 09:31:02 +0000 2018,Fendi,A mini briefcase completes the casual business look. More #FendiSS18: https://t.co/dZkR58L2SR https://t.co/hjcclMlSXj,978927432483794945
3,Tue Mar 27 22:47:43 +0000 2018,Fendi,Contrast threading adds luxurious appeal to the #FendiKanI. See the full selection on on https://t.co/LPxAHLVWb6 #FendiSS18 https://t.co/j9WqKHuMqC,978765537852383232
4,Tue Mar 27 17:47:42 +0000 2018,Fendi,Silk denim reinterprets sporty looks in a luxurious way. More #FendiSS18: https://t.co/SaSdi3YZYB https://t.co/MaoFJsThS9,978690034294403072
5,Tue Mar 27 11:30:10 +0000 2018,Fendi,Tropical leaves transform into intricate details. Take a closer look at the #FendiSS18 Collection: https://t.co/iEVb8GsxQO https://t.co/FcKRPIJzXZ,978595028313415681
6,Mon Mar 26 20:00:13 +0000 2018,Fendi,Full skirts styled with summer shirts for a luxurious and feminine #FendiSS18 look. Discover the collection: https://t.co/QYu7kXQnjK https://t.co/QKl7Fsy5Ju,978360998431096838
7,Mon Mar 26 16:00:01 +0000 2018,Fendi,Tropical colors are splashed across three luxurious leather pouches. Find the #FendiTriplette and more: https://t.co/pHQ5Oy8mLD #FendiSS18 https://t.co/BgOqFQaV1g,978300550872678400
8,Mon Mar 26 09:10:27 +0000 2018,Fendi,Fendi's signature savoir-faire is demonstrated by intricate threading seen throughout the #FendiSS18 Collection. Discover more: https://t.co/dl5KDl4r04 https://t.co/4fOjIjSYcM,978197479245123589
9,Sun Mar 25 21:00:18 +0000 2018,Fendi,From the seaside to the street. Chic slides to see you through the season: https://t.co/C8jUWjYLYi #FendiSS18 https://t.co/4J8CaQioTA,978013728829517825
10,Sun Mar 25 17:00:51 +0000 2018,Fendi,Details make the man. See the full #FendiSS18 selection: https://t.co/tmFFLKi01a https://t.co/ngoKbWGgg1,977953470186635265
11,Sun Mar 25 09:30:01 +0000 2018,Fendi,Walking into a new week in #FendiSS18. Now on https://t.co/LPxAHLVWb6 https://t.co/i4sgY7SRxG,977840015890833409
12,Sat Mar 24 21:00:39 +0000 2018,Fendi,A practical and stylish backpack personalized with contrasting Forever Fendi ribbon. More #FendiSS18: https://t.co/dZkR58L2SR https://t.co/HXfejGyZcb,977651429845344256
13,Sat Mar 24 16:30:46 +0000 2018,Fendi,Modern designs for stylish and easy organization. More #FendiSS18: https://t.co/gPflIfTIhP https://t.co/UAZEONkPaT,977583511115726848
14,Sat Mar 24 08:00:19 +0000 2018,Fendi,A touch of the iconic FF logo is felt throughout the #FendiSS18 Collection. Discover more: https://t.co/dZkR58L2SR https://t.co/mF2rVD3UuT,977455050837536768
15,Fri Mar 23 20:45:28 +0000 2018,Fendi,"Feminine stripes from the #FendiSS18 Collection, as seen in @BazaarUK. Photographed by #AgataPospieszynska. https://t.co/xN3dtSVTIb",977285220389945344
16,Fri Mar 23 17:07:32 +0000 2018,Fendi,"Featured throughout the #FendiSS18 Collection, contrast threading adds a sophisticated splash of color to the #FendiKanI and more: https://t.co/ZwVNdJ97tt https://t.co/BMY4FKJJ1i",977230375050252290
17,Fri Mar 23 10:21:49 +0000 2018,Fendi,Symmetrical stripes are layered over and under feminine silhouettes for modern appeal. Explore the collection: https://t.co/QYu7kXyMsc #FendiSS18 https://t.co/asajjnYqHt,977128275733606400
18,Thu Mar 22 21:00:47 +0000 2018,Fendi,Timeless sophistication with a touch of tropical flair. Discover more: https://t.co/ZwVNdIRw4T #FendiSS18 #FendiPeekaboo https://t.co/EPiXyBcop2,976926689694396418
19,Thu Mar 22 18:00:30 +0000 2018,Fendi,"Go behind-the-scenes of the #FendiSS18 Advertising Campaign, photograhed by #KarlLagerfeld and starring #VittoriaCeretti: https://t.co/dl5KDl4r04 https://t.co/ybPb2Zw6xA",976881317798449154
20,Thu Mar 22 15:41:30 +0000 2018,Fendi,"@TssssUppp Hello, we kindly invite you to contact our customer care at https://t.co/LPxAHLEljy. Our team will be happy to assist you. Thank you, Fendi.",976846337659596801
21,Thu Mar 22 10:00:55 +0000 2018,Fendi,Symmetrical stripes add an element of futurism to feather-light dresses. Discover the #FendiSS18 Collection https://t.co/QYu7kXQnjK @TaylorMarieHill https://t.co/oeNibrReU1,976760625727614978
22,Wed Mar 21 21:00:38 +0000 2018,Fendi,Classic businesswear with a signature Fendi twist. Discover more: https://t.co/UZzXz2HkJp #FendiSS18 https://t.co/qyvOxAKHwn,976564264235237376
23,Wed Mar 21 17:00:53 +0000 2018,Fendi,A new take on classic business-attire: https://t.co/59mHojVDyJ #FendiSS18 https://t.co/QGVXg7Vytw,976503929356697600
24,Wed Mar 21 15:19:28 +0000 2018,Fendi,"New season. New shades. Everyday Fendi: https://t.co/RveoJcO8wu
#FendiSS18 https://t.co/niteST8dh0",976478407038038016
25,Tue Mar 20 21:00:24 +0000 2018,Fendi,Oversized outerwear to complete each look. More #FendiSS18: https://t.co/UZzXz2HkJp https://t.co/E5CTzsQMv7,976201813794816000
26,Tue Mar 20 17:00:18 +0000 2018,Fendi,Business-attire that goes beyond the office: https://t.co/59mHojVDyJ #FendiSS18 https://t.co/Ll7I4OHhbR,976141391733563392
27,Tue Mar 20 10:16:48 +0000 2018,Fendi,The #DARELVMH #EllesVMH event brought together 60 intrapreneurs from @LVMH and its Maisons to find innovative solutions to achieve gender balance in top management positions by 2020. Highlights: https://t.co/NQZqqpo5Mg https://t.co/VsVIZhWwbw,976039850460745728
28,Mon Mar 19 21:00:38 +0000 2018,Fendi,The season's chicest carry-all. Pre-order the new #FendiRunaway Shopper: https://t.co/vvOny9yzVv #FendiSS18 https://t.co/Y2nZtlJ9YC,975839485362450432
29,Mon Mar 19 17:00:03 +0000 2018,Fendi,Next level florals. Isabel Scholten photographed by Petrovsky &amp; Ramone in #FendiSS18 for @InStyleGermany. https://t.co/3JYiVSBfgG,975778941125328897
30,Mon Mar 19 11:45:13 +0000 2018,Fendi,Futuristic florals add a feminine feel to the #FendiSS18 Collection. Explore: https://t.co/QYu7kXyMsc https://t.co/ow6J2aEI1d,975699713415614464
31,Sun Mar 18 21:00:27 +0000 2018,Fendi,Tropical leaves embroidered with organza and crystals create refined contrast. Get inspired: https://t.co/QYu7kXQnjK #FendiSS18 https://t.co/OPukOnzTWJ,975477054333362176
32,Sun Mar 18 16:30:24 +0000 2018,Fendi,A staple off-shoulder silhouette reveals super soft knitwear. Discover more: https://t.co/QYu7kXQnjK #FendiSS18 https://t.co/uqtX1MESLA,975409091676848128
33,Sun Mar 18 08:30:51 +0000 2018,Fendi,Tropical mood. Lameka Fox for @ELLEmagazine in #FendiSS18 https://t.co/zUdGtVr5ic,975288411622858752
34,Sat Mar 17 21:00:55 +0000 2018,Fendi,A closer look at the #FendiSS18 Men's Collection reveals a hint of the iconic FF logo. More: https://t.co/B4cAMpFrHO https://t.co/UvzpiLF67d,975114781374873600
35,Sat Mar 17 16:30:50 +0000 2018,Fendi,Laid-back yet luxurious shades. New to Fendi: https://t.co/RveoJcwx7U #FendiSS18 #FendiEyewear https://t.co/k5bNbkeyE1,975046813047668736
36,Sat Mar 17 08:00:47 +0000 2018,Fendi,"The perfect 'fit' for the contemporary businessman, designed by Silvia Venturini Fendi. Discover more: https://t.co/V8el4LXRqt #FendiPeekaboo #FendiSS18 https://t.co/9IXHFxT581",974918453751508992
37,Fri Mar 16 21:00:15 +0000 2018,Fendi,A natural palette of beiges and sand sets the tone for the #FendiSS18 collection. Explore: https://t.co/59mHojVDyJ https://t.co/r4mDVMcWKu,974752225330266113
38,Fri Mar 16 18:00:02 +0000 2018,Fendi,"Carry that distinct Friday feeling every day. New men's footwear: https://t.co/C8jUWkgmPQ
#FendiSS18 https://t.co/3rwykSFoes",974706872178454528
39,Fri Mar 16 09:30:20 +0000 2018,Fendi,Complete your look with casual yet corporate staples. More from the #FendiSS18 collection: https://t.co/gPflIfTIhP https://t.co/LoVf08Ghcp,974578604590813185
40,Thu Mar 15 20:30:41 +0000 2018,Fendi,Summer ready prints from the #FendiSS18 Collection. Seen in @ELLETurkey. https://t.co/qegw7iQtjw,974382399323701248
41,Thu Mar 15 17:27:43 +0000 2018,Fendi,"@mt3bovic @bellahadid Hello, we kindly invite you to contact our customer care at https://t.co/LPxAHLEljy. Our team will be happy to assist you. Thank you, Fendi",974336351507243008
42,Thu Mar 15 16:45:28 +0000 2018,Fendi,Subtle sensual cut-out details. More from the #FendiSS18 collection: https://t.co/QYu7kXQnjK @bellahadid https://t.co/43tU9cYRV2,974325719072358400
43,Thu Mar 15 11:09:55 +0000 2018,Fendi,Summer ready dresses with luxurious feminine appeal. More from the #FendiSS18 Collection: https://t.co/QYu7kXyMsc https://t.co/7QQTGdBd3W,974241277104590848
44,Wed Mar 14 21:00:45 +0000 2018,Fendi,Luxurious graphism meets Tropical Futurism in a modern and cool way. Discover the new collection now: https://t.co/QYu7kXQnjK https://t.co/CrnyzjQslY,974027577038798854
45,Wed Mar 14 17:00:21 +0000 2018,Fendi,"Feminine day dresses for a striking Summer wardrobe.
More from the #FendiSS18 collection: https://t.co/QYu7kXQnjK https://t.co/7It2tdJ2rR",973967077760356353
46,Wed Mar 14 13:45:57 +0000 2018,Fendi,Intricate laced detailing adds feminine flair to the #FendiKanI. Discover more: https://t.co/XauU4zSPWE #FendiSS18 https://t.co/2iCaoGqWGw,973918155708837888
47,Tue Mar 13 22:00:01 +0000 2018,Fendi,Sleek lines with a hint of #FisFendi. More from #FendiEyewear: https://t.co/Ow7WWMd1aJ #FendiSS18 https://t.co/W5WeYd6ldc,973680103203852288
48,Tue Mar 13 20:00:01 +0000 2018,Fendi,A striking balance between innovative design and high savoir-fare. Explore the full #FendiColibri selection on https://t.co/LPxAHLVWb6. #FendiSS18 https://t.co/bT4yf5WhkX,973649903334211584
49,Tue Mar 13 17:47:58 +0000 2018,Fendi,#FendiMonTresor and #FendiKanI: Mini Bags. Maximum impact. Find your favorite on https://t.co/LPxAHLEljy https://t.co/dAvkBgklqw,973616671800905728
50,Mon Mar 12 13:07:19 +0000 2018,Fendi,Tropical details from the #FendiSS18 Collection. Now on https://t.co/LPxAHLEljy https://t.co/JxrDGX5R4l,973183659040821250
51,Sun Mar 11 14:45:00 +0000 2018,Fendi,The elegant and versatile #FendiIshine twists to complement your style. Explore the full #FendiTimepieces selection: https://t.co/mImfWjrNKl https://t.co/RkNssOBuuc,972845853441445888
52,Sun Mar 11 10:00:01 +0000 2018,Fendi,Timeless Luxury Goes Petite. Meet the #FendiPeekaboo Essentially now on https://t.co/LPxAHLEljy #FendiSS18 https://t.co/N2C5MEBe6B,972774136027246594
53,Sat Mar 10 21:00:39 +0000 2018,Fendi,Knock-out accessories straight off the #FendiSS18 catwalk. See the full selection: https://t.co/ZwVNdIRw4T https://t.co/immUGnV9Bw,972578002025431040
54,Sat Mar 10 17:00:37 +0000 2018,Fendi,Diaphanous layers add an air of romance to the #FendiSS18 Collection. Find these styles and more: https://t.co/iEVb8GsxQO https://t.co/lCRuFCXsgc,972517593889165319
55,Sat Mar 10 04:30:40 +0000 2018,Fendi,"The Fendi Boutique in Omotesando, Tokyo, transforms into an urban jungle featuring the new #FendiSS18 collections. Discover more in boutique! https://t.co/C8tjWZW0xh",972328863601647616
56,Fri Mar 09 17:00:07 +0000 2018,Fendi,For the office or when you are on the move: https://t.co/C7Xn73uFCW #FendiSS18 https://t.co/3H3Rt3h4h9,972155079481413632
57,Fri Mar 09 13:11:48 +0000 2018,Fendi,"Escape the 9-to-5 grind at Palazzo Fendi in Rome.
Discover the newest #FendiSS18 arrivals now! https://t.co/Mbd4vt5b2z",972097622973526018
58,Thu Mar 08 20:00:29 +0000 2018,Fendi,A touch of tropical charm. Meet the Space Monkeys now: https://t.co/YjAfnt9iG1 https://t.co/eFDoqRCVzb,971838082633707520
59,Thu Mar 08 15:00:43 +0000 2018,Fendi,"Multicolor slingbacks and socks, a chic style combination. See the full #FendiColibri selection: https://t.co/QmTSyiMGu9 #FendiSS18 https://t.co/TQ08poufZY",971762646042079233
60,Thu Mar 08 09:30:34 +0000 2018,Fendi,Geometric motifs in feather-light fabrics. Get inspired by the Fendi Women's Spring/Summer 2018 Collection: https://t.co/iEVb8GsxQO https://t.co/MEJuTA2spM,971679557496352769
61,Wed Mar 07 20:30:03 +0000 2018,Fendi,The #FendiPeekaboo Essentially accessorized with a quirky and charming Space Monkey. See the full #FendiCharm selection: https://t.co/YjAfnt9iG1 #FendiSS18 https://t.co/tQBYY4UHWF,971483136646266880
62,Wed Mar 07 16:00:02 +0000 2018,Fendi,Aliz Menyhert photographed by @xavigordo for @Grazia in a streamlined #FendiSS18 silhouette. https://t.co/V5UuWtvHqD,971415183967965184
63,Wed Mar 07 09:01:33 +0000 2018,Fendi,"Palazzo Fendi in Rome is alight with a mix of futuristic and tropical elements, inspired by the #FendiSS18 collection. Discover more in boutique. https://t.co/6W6dkderID",971309867817369600
64,Tue Mar 06 21:28:00 +0000 2018,Fendi,The stylish slim silhouette of the #FendiPeekaboo Fit Mini makes it the perfect 'Fit' for the modern businessman: https://t.co/o67x6KJcdg #FendiSS18 https://t.co/CpLPJqKETv,971135332774158336
65,Tue Mar 06 14:37:35 +0000 2018,Fendi,"RT @LVMH: 750 candidates, 60 participants, 14 different nationalities, 28 LVMH Maisons… #DARELVMH is back to work on the theme of gender re…",971032048289898497
66,Mon Mar 05 21:30:02 +0000 2018,Fendi,"#FendiPopTour. Inspired by the city of Rome, pre-order the six special t-shirts exclusively on https://t.co/LPxAHLVWb6: https://t.co/oGsWcsfaT8 https://t.co/sOpnk9vHnR",970773456382914560
67,Mon Mar 05 17:21:19 +0000 2018,Fendi,Summer postcards from Rome. Discover the #FendiPopTour: https://t.co/oGsWcsfaT8 https://t.co/TUAlLatvxu,970710861831585792
68,Mon Mar 05 13:26:28 +0000 2018,Fendi,.@bellahadid makes a full FF statement in #FendiFW18. https://t.co/HslaE5yBGC,970651759860428800
69,Sun Mar 04 22:00:48 +0000 2018,Fendi,The Fendi Boutique in Soho transforms into a luxurious tropical-inspired paradise. Discover more in store! #NYC #FendiSS18 https://t.co/0AGmVAoeiL,970418809453473792
70,Sun Mar 04 17:00:35 +0000 2018,Fendi,Little Kickers #FendiKids. Photographed by Cloudo UK. https://t.co/fPIIQI3Z0b,970343257774309378
71,Sun Mar 04 08:00:58 +0000 2018,Fendi,Playful and practical designs. Explore the #FendiKids selection for this style and more: https://t.co/J0NcoK4EdA https://t.co/9nlzwP2kpu,970207457371828224
72,Sat Mar 03 20:00:51 +0000 2018,Fendi,Tailored on top and relaxed on the bottom. More footwear from the #FendiSS18 collection: https://t.co/C8jUWkgmPQ https://t.co/ADBhS6lq55,970026235219755008
73,Sat Mar 03 16:30:58 +0000 2018,Fendi,The timeless sophistication of the #FendiPeekaboo is bound to impress in the boardroom: https://t.co/s8Vj6PjSQm #FendiSS18 https://t.co/FigzPqMVMW,969973416945004544
74,Sat Mar 03 10:00:03 +0000 2018,Fendi,"Executive realness with an ironic Fendi twist. Discover the #FendiSS18 Collection by Creative Director Silvia Venturini Fendi, now on https://t.co/LPxAHLVWb6 https://t.co/bm99E9s2WU",969875041595764742
75,Fri Mar 02 21:00:03 +0000 2018,Fendi,Tropical Futurism takes over the windows of the Fendi Boutique on Madison Avenue in New York. Drop by to discover more from the Spring/Summer 2018 Collection. https://t.co/auHeVWC97X,969678746125983746
76,Fri Mar 02 17:00:40 +0000 2018,Fendi,A strong yet feminine silhouette. Explore the #FendiSS18 collection: https://t.co/dl5KDkMPBu https://t.co/6ajHPxEFgf,969618504079978496
77,Fri Mar 02 08:00:58 +0000 2018,Fendi,Which is you favorite new #FendiCharm? https://t.co/YjAfnt9iG1 #FendiSS18 https://t.co/TGEBBvJApk,969482685444800512
78,Thu Mar 01 20:30:18 +0000 2018,Fendi,.@GiGiHadid in a #FendiFW18 look during #PFW. https://t.co/7Es3oDSegV,969308873159884801
79,Thu Mar 01 16:40:29 +0000 2018,Fendi,"Discover #INSIDELVMH, a groundbreaking program for students from 50 schools and universities, as well as interns working within the Group: https://t.co/m8e7jl6AWW https://t.co/2eWQmnDOBW",969251034215444481
80,Thu Mar 01 10:29:56 +0000 2018,Fendi,"RT @LVMH: #LVMH launches #INSIDELVMH, an immersive program for young talents that deepens synergies between the academic and business world…",969157784888594433
81,Wed Feb 28 21:00:47 +0000 2018,Fendi,Attitude makes the man. @Jamiebower in #FendiSS18 for @LOfficielUSA. #FendiEyewear https://t.co/h0CEjkGhls,968954155304763392
82,Wed Feb 28 17:00:32 +0000 2018,Fendi,"Everyday objects with a touch of Fendi flair. Take a closer look: https://t.co/dZkR58L2SR
#FendiSS18 #SueTilley https://t.co/hzOMKWWGfs",968893695889096705
83,Wed Feb 28 13:19:45 +0000 2018,Fendi,That distinct Fendi feel. More from the #FendiSS18 Men's Collection by Silvia Venturini Fendi: https://t.co/h8FdPEumPd https://t.co/MRk5q42zyn,968838130433495041
84,Tue Feb 27 22:00:56 +0000 2018,Fendi,"Sensual and strong, #LuzPavon in a #FendiSS18 Dress for @ELLEUK. Photographed by Clay Stephen Gardner. https://t.co/A8JFNZpTXU",968606903352766464
85,Tue Feb 27 18:00:32 +0000 2018,Fendi,Statement sleeves from the #FendiSS18 Collection. See more: https://t.co/QYu7kXQnjK https://t.co/qbly0jxxHV,968546407547158529
86,Tue Feb 27 10:32:18 +0000 2018,Fendi,The geometric lines of the #FendiSS18 offset by strong architectural structures. #DaphneGroeneveld photographed in Rome for #HarpersBazaarRussia. https://t.co/0OctAoxqKN,968433604823928834
87,Mon Feb 26 21:01:07 +0000 2018,Fendi,Carry a touch of the tropics with you everyday. Meet your new favorite #FendiCharm now on https://t.co/LPxAHLVWb6 #FendiSS18 https://t.co/RLgXrlHoaf,968229464101433344
88,Mon Feb 26 17:00:30 +0000 2018,Fendi,On the streets of #MFW. #VittoriaCeretti in an FF sweatshirt before the #FendiFW18 Fashion Show. https://t.co/oxtj35HG5a,968168911807029250
89,Mon Feb 26 10:05:21 +0000 2018,Fendi,"Tropical flair at the Fendi Boutique in Milan. Featuring larger-than-life Space Monkeys, the latest addition to the #FendiCharm family. #FendiSS18 https://t.co/CnYG6kItmv",968064435951616000
90,Sun Feb 25 20:30:23 +0000 2018,Fendi,Luxurious leather 'Space Monkeys' add an element of playfulness to the #FendiSS18 collection. Take a closer look: https://t.co/YjAfnt9iG1 #FendiCharm https://t.co/ODwTs2ZRJc,967859339091329024
91,Sun Feb 25 15:00:28 +0000 2018,Fendi,"A modern take on the signature silhouette, meet the #FendiPeekaboo Essentially on https://t.co/LPxAHLVWb6 #FendiSS18 https://t.co/F1yKYHTkqT",967776314571673600
92,Sun Feb 25 08:00:44 +0000 2018,Fendi,Fendi China Ambassador #Nazha at the #FendiFW18 Fashion Show. https://t.co/yyBgcSPhc6,967670685194530816
93,Sat Feb 24 21:00:24 +0000 2018,Fendi,"Seen on the streets of #MFW, @ChriselleLim in a #FendiResort18 jacket. https://t.co/45few64SOW",967504507633414144
94,Sat Feb 24 15:41:54 +0000 2018,Fendi,Chic siblings @ChloeGMoretz and Trevor Moretz backstage at the #FendiFW18 Fashion Show. #MFW https://t.co/KGIB83GyIa,967424355570470913
95,Fri Feb 23 19:30:30 +0000 2018,Fendi,"See the best of backstage from the #FendiFW18 Fashion Show, now on https://t.co/LPxAHLVWb6: https://t.co/Y6EaNuqns5 https://t.co/wW7SRwp9WO",967119495721402371
96,Fri Feb 23 17:00:24 +0000 2018,Fendi,"#SergeBrunschwig, CEO of Fendi, joins Creative Directors #KarlLagerfeld &amp; #SilviaVenturiniFendi at the #FendiFW18 Fashion Show. We are very pleased to welcome him to the Fendi family. https://t.co/TzFvw5gl7X",967081719634345985
97,Fri Feb 23 14:30:21 +0000 2018,Fendi,Minimal Western boots featuring a double Cuban heel stepped out on the #FendiFW18 runway. https://t.co/5v79Crk68H,967043958164500480
98,Fri Feb 23 14:00:58 +0000 2018,Fendi,The simple elegance of lady's handkerchief is translated into silk dresses seen throughout the #FendiFW18 Collection. https://t.co/Lxe9P6cV6H,967036565363998722
99,Fri Feb 23 13:30:31 +0000 2018,Fendi,The Double F shoulder bag revealed for the first time during the #FendiFW18 Collection is defined by 'F' corner frames and the round Fendi stamp. https://t.co/ZkeL02jsth,967028903008075776
100,Fri Feb 23 12:57:40 +0000 2018,Fendi,"Defined by a soft construction, the new unstructured #FendiPeekaboo X-Lite makes its debut on the #FendiFW18 runway. https://t.co/IJ8rYumKzL",967020634621562880
101,Thu Feb 22 19:13:56 +0000 2018,Fendi,".@annadellorusso, @Bat_Gio and @OliviaPalermo at the #FendiFW18 Fashion Show. #MFW https://t.co/cQYXNWouWE",966752936775880705
102,Thu Feb 22 19:08:55 +0000 2018,Fendi,.@Carodaur with Lisa and Lena Mantler at the #FendiFW18 Fashion Show. #MFW https://t.co/OisdoPgEF9,966751676043579393
103,Thu Feb 22 18:40:38 +0000 2018,Fendi,".@Jamiebower, @bower_sam and @tommydorfman at the #FendiFW18 Fashion Show. #MFW https://t.co/sPvIUqHA8l",966744556661366785
104,Thu Feb 22 17:30:15 +0000 2018,Fendi,"A mirror of softness and strength. #FendiFW18 #MFW
https://t.co/wEUo2ym512 https://t.co/qsLV8DNNa6",966726844132175872
105,Thu Feb 22 15:30:29 +0000 2018,Fendi,Urban femininity with an outdoor edge. #FendiFW18 #MFW https://t.co/1xCgc2NZZS,966696703582658561
106,Thu Feb 22 14:19:06 +0000 2018,Fendi,A romantic uniform for the modern urban woman. #FendiFW18 #MFW https://t.co/Od6FRtzMpn,966678742356676608
107,Thu Feb 22 11:28:30 +0000 2018,Fendi,The #FendiFW18 Fashion Show is about to begin. Experience the collection LIVE from #MFW on https://t.co/LPxAHLEljy. https://t.co/e9lvKytGiQ,966635809003769856
108,Wed Feb 21 21:01:04 +0000 2018,Fendi,Fendi Women's Spring/Summer 2018 Collection. Thursday February 22nd at 12.30pm (CET) #FendiSS18 #MFW https://t.co/bi70LRg5sc,966417511968268288
109,Wed Feb 21 17:30:34 +0000 2018,Fendi,"Tune into the #FendiSS18 Women's Fashion Show, LIVE from #MFW on Instagram, Facebook and https://t.co/LPxAHLVWb6 tomorrow at 12.30pm (CET) https://t.co/efuZhEn3Gb",966364536344215552
110,Wed Feb 21 14:45:41 +0000 2018,Fendi,.@GiGiHadid sporting FF accents and futuristic #FendiResort18 shades in New York. https://t.co/JDuc2YqOat,966323044418387968
111,Wed Feb 21 10:07:26 +0000 2018,Fendi,.@haileybaldwin in #FendiSS18 at the London #FundFair for @NakedHeartF. https://t.co/SuOyBmEbV9,966253017484943360
112,Tue Feb 20 21:45:13 +0000 2018,Fendi,Starting off #MFW with a look at some of the best backstage moments from September's #FendiSS18 Fashion Show. https://t.co/J8BjgcywYz,966066234839089152
113,Tue Feb 20 17:00:38 +0000 2018,Fendi,Structured silhouettes meet symmetrical stripes. Nina Marker styled by #CarineRoitfeld in #FendiSS18 for @harpersbazaarus. https://t.co/Qak5fXr4np,965994617677033473
114,Tue Feb 20 12:02:48 +0000 2018,Fendi,"Feminine with a sporty detail, elevate any look with the #FendiColibri. Now on https://t.co/LPxAHLEljy #FendiSS18 https://t.co/uhzIGBbu2S",965919664609087488
115,Tue Feb 20 09:33:35 +0000 2018,Fendi,"RT @LVMH: The LVMH Group is pleased to announce the appointment of Serge Brunschwig as Chairman and CEO of @Fendi.
#LVMHtalents #LVMH #Fend…",965882111424172032
116,Mon Feb 19 21:30:23 +0000 2018,Fendi,"Behind-the-scenes of the #FendiSS18 Women's Advertising Campaign photographed by #KarlLagerfeld, and starring models #VittoriaCeretti and @TaylorMarieHill. https://t.co/W65r1cgkag",965700112822321152
117,Mon Feb 19 17:00:51 +0000 2018,Fendi,Symmetrical stripes add a graphic element to the #FendiSS18 Collection. Now on https://t.co/LPxAHLVWb6 https://t.co/Oo6nRlwKhC,965632283553161222
118,Mon Feb 19 08:42:29 +0000 2018,Fendi,.@NinaAgdal with the #FendiKanI 'F' Small in leather. https://t.co/yMDc2vaXX1,965506865034604544
119,Sun Feb 18 21:00:02 +0000 2018,Fendi,.@katyperry is fierce in #FendiSS18 for @glamourmag. Photography by Emma Summerton. https://t.co/Ybsg55rKbP,965330089629040640
120,Sun Feb 18 15:00:41 +0000 2018,Fendi,"Accessorize with a #StrapYou for instant floral detailing. More from the #FendiResort18 collection, now on https://t.co/LPxAHLVWb6 https://t.co/1GFtyCJCCp",965239655988736001
121,Sun Feb 18 08:00:41 +0000 2018,Fendi,Wear the #FendiSelleria your way with three interchangeable staps. Explore the latest from #FendiTimepieces: https://t.co/SapuyM5F9o #FendiSS18 https://t.co/suZ83gbWcF,965133956399038464
122,Sat Feb 17 22:15:06 +0000 2018,Fendi,Get up and move in dynamic #FendiAthleisure. Complete your look: https://t.co/dcwd5PEhC1 https://t.co/cSdGHjeEPJ,964986591226691585
123,Sat Feb 17 18:00:35 +0000 2018,Fendi,White or black... which is your favorite #TheRingoftheFuture tee? Take a closer look at the first ever genderless t-shirt: https://t.co/qTm6Mr8Gly https://t.co/CYY4pfQjXs,964922539737718784
124,Sat Feb 17 11:00:11 +0000 2018,Fendi,"Casual, corporate or out and about, the #FendiResort18 collection has you covered. Karen Ong Tan for @sgtatler https://t.co/AhFuvVrNfM",964816741569200129
125,Fri Feb 16 22:00:28 +0000 2018,Fendi,Kicking of the weekend with positive feels and a white #TheRingoftheFuture t-shirt. Copy yours here: https://t.co/qTm6Mr8Gly #FisForFendi. https://t.co/Qlg0ndo8Ll,964620519009009664
126,Fri Feb 16 20:00:50 +0000 2018,Fendi,#StellaMaxwell is laidback and lady-like in statement orange for @VogueThailand. #FendiResort18 https://t.co/PyL9bZpCYY,964590411867029504
127,Fri Feb 16 11:30:17 +0000 2018,Fendi,Delicate florals and exquisite embroidered details set the #FendiResort18 collection apart. See what's new now on https://t.co/LPxAHLVWb6 https://t.co/1rCpHvYHPp,964461929384222720
128,Fri Feb 16 09:13:47 +0000 2018,Fendi,"RT @LVMH: Thank you to all students from @Grenoble_EM and @UniLUISS who joined us for these 2 #LVMHday! Each year, the LVMH Group hire 7,50…",964427576717426690
129,Thu Feb 15 21:00:21 +0000 2018,Fendi,"Clean lines meet contemporary design. Finish your look with a pair of #EverydayFendi frames, now on https://t.co/LPxAHLVWb6 #FendiEyewear #FendiSS18 https://t.co/ZFntSU1ThM",964243004784459776
130,Thu Feb 15 16:30:39 +0000 2018,Fendi,The right way to rock pearls. #FendiResort18 sandals photographed by Bobby Doherty for @TheCut. https://t.co/ioTg6jrgpS,964175133379198976
131,Thu Feb 15 16:28:13 +0000 2018,Fendi,"RT @LVMH: #LVMHday at @UniLUISS: Delivering excellence and anticipating future desires with Nicola Di Napoli, @dior Store Manager Roma Piaz…",964174519459033090
