,created,handle,text,tweet_id
0,Mon Mar 26 16:40:58 +0000 2018,HELMUT LANG,"@KimKardashian wearing Helmut Lang seen by Shayne Oliver for @ODDAmagazine 
PHOTOGRAPHY @sitabellan 
EDITOR David Martin https://t.co/malQr0Xt1T",978310855476604929
1,Mon Mar 26 13:45:09 +0000 2018,HELMUT LANG,"@amandlastenberg wearing Helmut Lang seen by Shayne Oliver for the cover of Indie Magazine
PHOTOGRAPHY @lukegilford 
FASHION Dogukan Nesanir https://t.co/5u0YHSQz1O",978266610485157888
2,Thu Mar 08 21:15:54 +0000 2018,HELMUT LANG,"Helmut Lang Spring '18
Styling by Stevie Dance
https://t.co/WRnhACPO2M https://t.co/VGgbnQBRSZ",971857062811533313
3,Thu Mar 08 21:15:05 +0000 2018,HELMUT LANG,"Helmut Lang Spring '18
Styling by Stevie Dance
https://t.co/WRnhACPO2M https://t.co/Z11bxbIxdZ",971856857802395648
4,Thu Mar 08 21:13:32 +0000 2018,HELMUT LANG,"Helmut Lang Spring '18
Styling by Stevie Dance
https://t.co/WRnhACPO2M https://t.co/DIdDYnAv1G",971856466033500166
5,Thu Mar 08 21:06:22 +0000 2018,HELMUT LANG,"@solangeknowles wearing Helmut Lang seen by Shayne Oliver for @billboard 
PHOTOGRAPHY Ruven Fanador 
FASHION Kyle Luu https://t.co/3mtH0CEU0p",971854660893118469
6,Wed Mar 07 19:33:23 +0000 2018,HELMUT LANG,HELMUT LANG SPRING 2018 by Alex Lee https://t.co/vt2yrvCgiN,971468875534667776
7,Wed Mar 07 16:12:59 +0000 2018,HELMUT LANG,HELMUT LANG SPRING 2018 by Alex Lee https://t.co/QdOavEZWHT,971418444330622976
8,Wed Mar 07 16:06:44 +0000 2018,HELMUT LANG,HELMUT LANG SPRING 2018 by Alex Lee https://t.co/7a3IZN9Nm4,971416868614483968
9,Mon Mar 05 21:29:16 +0000 2018,HELMUT LANG,"@solangeknowles wearing Helmut Lang seen by Shayne Oliver for @billboard PHOTOGRAPHY @ruvenafanador 
FASHION Kyle Luu https://t.co/EYSamHqtbW",970773263730212864
10,Mon Mar 05 16:26:53 +0000 2018,HELMUT LANG,"Helmut Lang seen by Shayne Oliver featured in @BritishVogue
PHOTOGRAPHY Theo Sion
FASHION Poppy Kain
EDITOR Olivia Singer https://t.co/8LQcSGHiHI",970697166116278272
11,Mon Feb 26 15:56:28 +0000 2018,HELMUT LANG,Raf Simons in the Helmut Lang Denim Jacket with Stripes at the @Dior Spring/Summer 2013 show. Shop the Re-Edition collection now at https://t.co/WRnhACPO2M https://t.co/N83EVNBjVU,968152796519419904
12,Wed Feb 14 21:43:42 +0000 2018,HELMUT LANG,"Helmut Lang seen by Shayne Oliver featured in @BritishVogue 
PHOTOGRAPHY Theo Sion
FASHION Poppy Kain
EDITOR Olivia Singer https://t.co/23GcHl5n5H",963891524621783040
13,Tue Feb 13 17:48:16 +0000 2018,HELMUT LANG,"8/8: T-SHIRT WITH STRIPES by HELMUT LANG. First produced in 1997. Helmut Lang Re-Edition Vol. 2 is available now at select retailers, Helmut Lang stores and https://t.co/WRnhACPO2M https://t.co/2NEoa1sxsL",963469886533009409
14,Tue Feb 13 15:18:05 +0000 2018,HELMUT LANG,"7/8: TANK WITH SLEEVES by HELMUT LANG. First produced in 2004. Helmut Lang Re-Edition Vol. 2 is available now at select retailers, Helmut Lang stores and https://t.co/WRnhACPO2M https://t.co/fHdwvrgPxS",963432095162011648
15,Mon Feb 12 21:50:11 +0000 2018,HELMUT LANG,"6/8: TURN-UP JEANS by HELMUT LANG. First produced in 1998. Helmut Lang Re-Edition Vol. 2 is available now at select retailers, Helmut Lang stores and https://t.co/WRnhACPO2M https://t.co/GNRT5LRDt3",963168379925417984
16,Mon Feb 12 21:35:52 +0000 2018,HELMUT LANG,"5/8: LAYERED DIAMOND HEAD DRESS by HELMUT LANG. First produced in 1995. Helmut Lang Re-Edition Vol. 2 is available now at select retailers, Helmut Lang stores and https://t.co/WRnhACPO2M https://t.co/m2fT6VPCSl",963164778050084864
17,Mon Feb 12 21:35:27 +0000 2018,HELMUT LANG,"4/8: KEYRINGS by HELMUT LANG. First produced in 2003. Helmut Lang Re-Edition Vol. 2 is available now at select retailers, Helmut Lang stores and https://t.co/WRnhACPO2M https://t.co/5L7dkdkpwd",963164674245177344
18,Mon Feb 12 21:32:52 +0000 2018,HELMUT LANG,"3/8: DIAMOND HEAD TANK by HELMUT LANG. First produced in 1995. Helmut Lang Re-Edition Vol. 2 is available now at select retailers, Helmut Lang stores and https://t.co/WRnhACPO2M https://t.co/9wFkYl9VD8",963164024790769665
19,Mon Feb 12 20:49:16 +0000 2018,HELMUT LANG,"2/8: SHOPPING BAG by HELMUT LANG. First produced in 2003. Helmut Lang Re-Edition Vol. 2 is available now at select retailers, Helmut Lang stores and https://t.co/WRnhACycEc https://t.co/DuyX9jSBLL",963153049148579840
20,Mon Feb 12 17:50:30 +0000 2018,HELMUT LANG,"1/8: DENIM JACKET WITH STRIPES by HELMUT LANG. First produced in 1997. Helmut Lang Re-Edition Vol. 2 is available now at select retailers, Helmut Lang stores and https://t.co/WRnhACPO2M https://t.co/aSCIFebdYX",963108063397011459
21,Mon Feb 05 20:05:25 +0000 2018,HELMUT LANG,"Helmut Lang Spring 2018 featuring Wilder
PHOTOGRAPHY by Alex Lee https://t.co/ZVN2Zugxab",960605301517975557
22,Mon Feb 05 16:18:04 +0000 2018,HELMUT LANG,"Helmut Lang Spring 2018 featuring Wilder
PHOTOGRAPHY by Alex Lee https://t.co/eTeEJDSokE",960548086610321409
23,Mon Feb 05 15:26:44 +0000 2018,HELMUT LANG,"Helmut Lang Spring 2018 featuring Wilder
PHOTOGRAPHY by Alex Lee https://t.co/06fOiltmDN",960535167034122240
24,Thu Jan 04 15:05:29 +0000 2018,HELMUT LANG,"HELMUT LANG FANS seen by EXACTITUDES® New York, 2018

PHOTOGRAPHY Ari Versluis &amp; Ellie Uyttenbroek - Exactitudes®
EDITOR-IN-RESIDENCE Isabella Burley
CREATIVE ADVISOR Ava Nirui
CASTING Danielle Emerson 
PRODUCTION Mary Turpin https://t.co/6ksToZZFyN",948933408520105984
25,Wed Dec 13 21:46:38 +0000 2017,HELMUT LANG,"Keizo Kitajima is the third artist in HELMUT LANG: THE ARTIST SERIES, focussing three high-contrast works taken on the streets of New York in the 80s. Shop now https://t.co/WRnhACPO2M https://t.co/NZJ7GSj1Dz",941061826170834945
26,Wed Dec 13 21:46:23 +0000 2017,HELMUT LANG,"Keizo Kitajima is the third artist in HELMUT LANG: THE ARTIST SERIES, focussing three high-contrast works taken on the streets of New York in the 80s. Shop now https://t.co/WRnhACPO2M https://t.co/HSTYAv9ycP",941061766636859392
27,Wed Dec 13 21:46:06 +0000 2017,HELMUT LANG,"Keizo Kitajima is the third artist in HELMUT LANG: THE ARTIST SERIES, focussing three high-contrast works taken on the streets of New York in the 80s. Shop now https://t.co/WRnhACPO2M https://t.co/1ed7jT0m0o",941061694750642176
28,Tue Dec 05 22:48:18 +0000 2017,HELMUT LANG,"Carlos, Tony and Isaul wear limited edition Helmut Lang Taxi merchandise. Shop the capsule now at select retailers, Helmut Lang stores and https://t.co/WRnhACPO2M
Photo by Alex Lee https://t.co/Iy5BUPiPmp",938178245459095552
29,Tue Dec 05 18:35:29 +0000 2017,HELMUT LANG,"Isaul is 57 years old and started driving New York City Taxis in 1996. He is from Honduras and currently resides in the Bronx, New York with his wife and 3 kids. Isaul wears the ©HELMUT LANG Hoodie in black. Shop the capsule now at https://t.co/WRnhACPO2M
Photos by Alex Lee https://t.co/jhow5cOQDY",938114618781782016
30,Tue Dec 05 15:27:35 +0000 2017,HELMUT LANG,"Carlos is 52 years old and started driving taxis in 1997. He is originally from Ecuador and currently lives in Corona, Queens with his wife and two teenage sons. Carlos wears the Taxi hoodie in yellow. Shop the capsule now at https://t.co/WRnhACPO2M
Photos by Alex Lee https://t.co/Hwb2NSLOh9",938067333976870913
31,Mon Dec 04 21:04:33 +0000 2017,HELMUT LANG,"Tony is 67 years old and started driving taxis in 1976. He is originally from Greece and currently resides in Bayside, Queens. Tony wears the Taxi Long sleeve in white. 
Shop the capsule now at select retailers, Helmut Lang stores and https://t.co/WRnhACPO2M
Photo by Alex Lee https://t.co/yJRY9YOuiI",937789748525051904
32,Mon Dec 04 20:59:27 +0000 2017,HELMUT LANG,"There are currently 275 Helmut Lang taxis circulating New York City. To celebrate, we have created a limited edition capsule of taxi merchandise inspired by the legacy of Helmut Lang. Available now at select retailers, in Helmut Lang stores and https://t.co/WRnhACPO2M https://t.co/LLcAqqvfS5",937788461645430784
33,Mon Dec 04 19:49:24 +0000 2017,HELMUT LANG,"This month, 275 Helmut Lang branded taxis will be circulating New York City. To celebrate, we have created a capsule of limited edition Taxi merchandise. Available now at https://t.co/WRnhACPO2M
Image taken by Iain R. Webb, 2001 https://t.co/9UCNIomJOm",937770833120059392
34,Mon Dec 04 19:10:17 +0000 2017,HELMUT LANG,"During New York Fashion Week, Shayne Oliver debuted his first collection for Helmut Lang under the new designer residency program. Today, the HELMUT LANG seen by SHAYNE OLIVER collection launches at https://t.co/WRnhACPO2M. PHOTOGRAPHY Nicolai Howalt STYLING Akeem Smith https://t.co/jOxgsDjntN",937760991491887106
35,Mon Dec 04 19:10:03 +0000 2017,HELMUT LANG,"During New York Fashion Week, Shayne Oliver debuted his first collection for Helmut Lang under the new designer residency program. Today, the HELMUT LANG seen by SHAYNE OLIVER collection launches at https://t.co/WRnhACPO2M. PHOTOGRAPHY Nicolai Howalt STYLING Akeem Smith https://t.co/pyOCkwomhb",937760930171060224
36,Mon Dec 04 19:09:42 +0000 2017,HELMUT LANG,"During New York Fashion Week, Shayne Oliver debuted his first collection for Helmut Lang under the new designer residency program. Today, the HELMUT LANG seen by SHAYNE OLIVER collection launches at https://t.co/WRnhACPO2M. PHOTOGRAPHY Nicolai Howalt STYLING Akeem Smith https://t.co/KBpmCYHtHw",937760841994244096
37,Fri Nov 17 18:04:15 +0000 2017,HELMUT LANG,WANT TO WIN A WALTER PFEIFFER PILLOW AND BLANKET? HEAD TO OUR INSTAGRAM (https://t.co/o9XMbVXeYg) to find out how. https://t.co/Pa34jBzvgl,931583778220371968
38,Thu Nov 16 16:53:15 +0000 2017,HELMUT LANG,"Kirsten Owen wearing HELMUT LANG seen by SHAYNE OLIVER for the cover story of @PUSSPUSSMAG Issue 6
Photography: Zora Sicher
Styling: Heathermary Jackson https://t.co/Jv0DW4qn3U",931203522338656256
39,Thu Nov 16 16:14:28 +0000 2017,HELMUT LANG,"Kirsten Owen on the cover of @PUSSPUSSMAG Issue 6 wearing HELMUT LANG seen by SHAYNE OLIVER
Photography: Zora Sicher
Styling: Heathermary Jackson https://t.co/DM1JEF4Di2",931193763535511553
40,Wed Nov 15 21:45:27 +0000 2017,HELMUT LANG,Slick Woods in HELMUT LANG seen by SHAYNE OLIVER at the @glamourmag Women Of The Year Awards 2017 https://t.co/L3OjwnYbZA,930914671682605057
41,Mon Nov 13 18:48:32 +0000 2017,HELMUT LANG,"HELMUT LANG seen by TALIA CHETRIT
WOMENS RESORT 2018
©HELMUT LANG https://t.co/fHkj4Wmtje",930145370369331200
42,Mon Nov 13 17:37:29 +0000 2017,HELMUT LANG,"HELMUT LANG seen by TALIA CHETRIT
WOMENS RESORT 2018
©HELMUT LANG https://t.co/wxuahCuVai",930127489795526658
43,Mon Nov 13 15:12:22 +0000 2017,HELMUT LANG,"HELMUT LANG seen by TALIA CHETRIT
WOMENS RESORT 2018
©HELMUT LANG https://t.co/vjvtxswBRt",930090973518094336
44,Wed Nov 08 17:23:13 +0000 2017,HELMUT LANG,Larger than life! The Walter Pfeiffer oversized pillow is perfect and available right now. Head to https://t.co/WRnhACPO2M to shop https://t.co/fYzxcvmwvW,928311959560257536
45,Wed Nov 08 17:13:34 +0000 2017,HELMUT LANG,This iconic Walter Pfeiffer image is now on a Helmut Lang shirt. Here's a finger trick you can try at home: type https://t.co/WRnhACPO2M into your browser and watch the magic unfold. You're welcome https://t.co/Jz1s3OmEiw,928309533428109312
46,Wed Nov 08 17:03:58 +0000 2017,HELMUT LANG,"Sweet dreams. The limited edition Artist Series: Walter Pfeiffer fleece blanket and pillow. Like Anna, you too can sleep with Walter... Just head to https://t.co/WRnhACPO2M to shop now https://t.co/yEN0M6FXzV",928307119228620800
47,Thu Nov 02 20:14:30 +0000 2017,HELMUT LANG,JAKE WEARS HELMUT LANG MENS RESORT 2018 designed by SHAYNE OLIVER. CLICK HERE TO SHOP: https://t.co/6FSCuvA65v https://t.co/AsTbBKOYuO,926180740911558657
48,Thu Nov 02 15:28:21 +0000 2017,HELMUT LANG,HANS WEARS HELMUT LANG MENS RESORT 2018 designed by SHAYNE OLIVER. CLICK HERE TO SHOP: https://t.co/6FSCuvA65v https://t.co/RpYtSGq4ZC,926108728138530817
49,Wed Nov 01 18:21:32 +0000 2017,HELMUT LANG,HELMUT LANG MENS RESORT 2018 designed by SHAYNE OLIVER is AVAILABLE NOW: https://t.co/6FSCuvA65v https://t.co/d2v2EM46cm,925789921394257920
50,Wed Nov 01 17:10:03 +0000 2017,HELMUT LANG,HELMUT LANG MENS RESORT 2018 designed by SHAYNE OLIVER is AVAILABLE NOW: https://t.co/6FSCuvA65v https://t.co/E6FW7OJWNG,925771932875751424
51,Wed Nov 01 15:50:41 +0000 2017,HELMUT LANG,HELMUT LANG MENS RESORT 2018 designed by SHAYNE OLIVER is AVAILABLE NOW: https://t.co/6FSCuvA65v https://t.co/XoGsr3kJ7e,925751961332453380
52,Tue Oct 31 22:20:28 +0000 2017,HELMUT LANG,"HELMUT LANG MENS RESORT 2018 designed by SHAYNE OLIVER. MODELED by PACE, MATT and DUSTIN. SHOP IT NOW: https://t.co/6FSCuvA65v https://t.co/uRu8LiCoGa",925487662156451840
53,Tue Oct 31 22:07:21 +0000 2017,HELMUT LANG,"HELMUT LANG MENS RESORT 2018 designed by SHAYNE OLIVER. MODELED by DENZEL, MATT and DYLAN. SHOP IT NOW: https://t.co/6FSCuvA65v https://t.co/B6p3qMEvXG",925484362497495041
54,Tue Oct 31 17:22:23 +0000 2017,HELMUT LANG,"IT'S HERE. HELMUT LANG MENS RESORT 2018 designed by SHAYNE OLIVER. MODELED by PACE, SARAH and DENZEL. SHOP IT NOW: https://t.co/6FSCuvA65v https://t.co/O8yAV6Lnqw",925412649369817088
55,Mon Oct 30 20:38:21 +0000 2017,HELMUT LANG,HELMUT LANG MENS RESORT 2018 designed by SHAYNE OLIVER is AVAILABLE NOW: https://t.co/6FSCuvA65v https://t.co/5ylIPtELoR,925099576910020609
56,Mon Oct 30 19:36:24 +0000 2017,HELMUT LANG,HELMUT LANG MENS RESORT 2018 designed by SHAYNE OLIVER is AVAILABLE NOW: https://t.co/6FSCuvA65v https://t.co/iPRfvXP78o,925083986887696387
57,Mon Oct 30 19:12:43 +0000 2017,HELMUT LANG,HELMUT LANG MENS RESORT 2018 designed by SHAYNE OLIVER is AVAILABLE NOW: https://t.co/6FSCuvA65v https://t.co/F032wSeMVO,925078028694228995
58,Sat Oct 28 19:23:47 +0000 2017,HELMUT LANG,The LIMITED EDITION WALTER PFEIFFER GREEN POSTER is available NOW. ONLY at HELMUT LANG STORES and ONLINE. SHOP NOW: https://t.co/70YKUDWc3I https://t.co/TIj7bXRmEv,924356036974301184
59,Sat Oct 28 19:17:57 +0000 2017,HELMUT LANG,DON'T SLEEP on the LIMITED EDITION ©WALTER PFEIFFER PILLOW. BIGGER and BETTER THAN EVER. SHOP NOW: https://t.co/70YKUDWc3I https://t.co/uGfYCN0bZS,924354567894073344
60,Wed Oct 25 17:59:32 +0000 2017,HELMUT LANG,COZY UP with THE ©WALTER PFEIFFER blanket. FOR A PERFECT SLEEP. SHOP NOW: https://t.co/70YKUDWc3I https://t.co/tUNnd6HrDd,923247671623680000
61,Wed Oct 25 16:20:12 +0000 2017,HELMUT LANG,"WALTER PFEIFFER, the first artist launching HELMUT LANG: THE ARTIST SERIES, IS FINALLY HERE. SHOP NOW: https://t.co/70YKUDWc3I https://t.co/QNkD2hbKGw",923222670786924545
62,Tue Oct 24 23:29:21 +0000 2017,HELMUT LANG,"WALTER PFEIFFER, the first artist launching HELMUT LANG: THE ARTIST SERIES, IS FINALLY HERE. SHOP NOW: https://t.co/70YKUDWc3I https://t.co/aSEorL7kjk",922968282910658560
63,Tue Oct 24 16:35:47 +0000 2017,HELMUT LANG,"WALTER PFEIFFER, the first artist launching HELMUT LANG: THE ARTIST SERIES, IS FINALLY HERE. SHOP NOW: https://t.co/70YKUDWc3I https://t.co/ruotRTyuff",922864204746543104
64,Mon Oct 23 18:41:57 +0000 2017,HELMUT LANG,GUESTS at the HELMUT LANG seen by SHAYNE OLIVER NYFW SHOW wearing RESORT 2018. SHOP NOW: https://t.co/w72mdXGpZF https://t.co/dZSTpQT1et,922533570077495297
65,Mon Oct 23 18:36:48 +0000 2017,HELMUT LANG,"THE HELMUT LANG Resort '18 COLLECTION is available now at SELECT RETAILERS, HELMUT LANG stores and ONLINE. SHOP NOW: https://t.co/w72mdXGpZF https://t.co/iO4xTiV4xa",922532271982284801
66,Mon Oct 23 18:35:38 +0000 2017,HELMUT LANG,"THE HELMUT LANG Resort '18 COLLECTION is available now at SELECT RETAILERS, HELMUT LANG stores and ONLINE. SHOP NOW: https://t.co/w72mdXGpZF https://t.co/D1fhYwF8IK",922531981098971136
67,Thu Oct 19 20:22:15 +0000 2017,HELMUT LANG,"HELMUT LANG RESORT '18 is  AVAILABLE NOW at SELECT RETAILERS, in HELMUT LANG STORES and ONLINE: https://t.co/w72mdXGpZF https://t.co/VqizJCTyJj",921109258510454785
68,Thu Oct 19 20:16:45 +0000 2017,HELMUT LANG,"HELMUT LANG RESORT '18 is  AVAILABLE NOW at SELECT RETAILERS, in HELMUT LANG STORES and ONLINE: https://t.co/w72mdXGpZF https://t.co/8wZQFvryAy",921107876810280960
69,Thu Oct 19 20:02:16 +0000 2017,HELMUT LANG,"THE SPIKED EARRINGS from HELMUT LANG RESORT '18.are AVAILABLE NOW at SELECT RETAILERS, HELMUT LANG STORES &amp; ONLINE: https://t.co/w72mdXGpZF https://t.co/zGzXvA15K8",921104231913918464
70,Mon Oct 16 18:38:58 +0000 2017,HELMUT LANG,"VENUS X wearing RESORT in the W MAGAZINE NOVEMBER ISSUE. PHOTOGRAPHY Jody Roga FASHION Lana Jay Lackey
SHOP NOW at https://t.co/WRnhACPO2M https://t.co/kAtpsmWf2E",919996102685978624
71,Mon Oct 09 18:54:58 +0000 2017,HELMUT LANG,MEKHI BACKSTAGE at HELMUT LANG seen by SHAYNE OLIVER via. OFFICE MAGAZINE https://t.co/dppE3Yvgkx,917463416473817092
72,Mon Oct 09 18:15:24 +0000 2017,HELMUT LANG,MARJAN BACKSTAGE at HELMUT LANG seen by SHAYNE OLIVER via. https://t.co/9osXj5z8VB https://t.co/1Ltb2oGoXZ,917453459120623619
73,Mon Oct 09 15:15:42 +0000 2017,HELMUT LANG,Last day to shop the HELMUT LANG FLASH SALE. 25% off SELECT STYLES. SHOP NOW: https://t.co/QBuisc0mnx,917408234062929920
74,Fri Oct 06 20:19:40 +0000 2017,HELMUT LANG,NAILS BACKSTAGE at HELMUT LANG seen by SHAYNE OLIVER via. @ELLEUK https://t.co/XEaBNM3Wcg,916397567637839872
75,Fri Oct 06 19:30:51 +0000 2017,HELMUT LANG,BACKSTAGE at HELMUT LANG seen by SHAYNE OLIVER via. @selfservicemag https://t.co/L0Xzs0M3aK,916385280327811073
76,Fri Oct 06 19:28:26 +0000 2017,HELMUT LANG,TGIF! SELENA FORREST for VOGUE MAGAZINE wearing HELMUT LANG seen by SHAYNE OLIVER. DIRECTOR Charlotte Wales EDITOR Jorden Bickham https://t.co/GymDR3XTaH,916384675509211138
77,Thu Oct 05 20:23:22 +0000 2017,HELMUT LANG,The SADDLE HOLSTER from RE-EDITION featured in the FALL '17 ISSUE of CR FASHION BOOK. PHOTOGRAPHY Mario Sorrenti FASHION Carine Roitfeld https://t.co/RlLAZ6uijv,916036109716672512
78,Thu Oct 05 20:20:59 +0000 2017,HELMUT LANG,The DETACHED CUFF T-SHIRT featured in the FALL '17 ISSUE of CR FASHION BOOK. PHOTOGRAPHY Mario Sorrenti FASHION Carine Roitfeld https://t.co/LgkemqPTJY,916035510266720258
79,Thu Oct 05 19:48:35 +0000 2017,HELMUT LANG,The NECKLACE CREWNECK featured in the FALL '17 ISSUE of CR FASHION BOOK. PHOTOGRAPHY Mario Sorrenti FASHION Carine Roitfeld https://t.co/Sn50qrg1Dp,916027356321632256
80,Mon Sep 25 21:27:57 +0000 2017,HELMUT LANG,WATCH the full HELMUT LANG seen by SHAYNE OLIVER SHOW at https://t.co/7ISzbwSgnR  (edit by MINNIE BENNETT) https://t.co/XSsjqtlhKb,912428485968302081
81,Mon Sep 25 20:38:26 +0000 2017,HELMUT LANG,WATCH the full HELMUT LANG seen by SHAYNE OLIVER SHOW at https://t.co/7ISzbwSgnR (edit by MINNIE BENNETT) https://t.co/LAPCjWom83,912416025395777536
82,Mon Sep 25 20:12:21 +0000 2017,HELMUT LANG,WATCH the full HELMUT LANG seen by SHAYNE OLIVER SHOW at https://t.co/7ISzbwSgnR (edit by MINNIE BENNETT) https://t.co/ZmGUYbONls,912409457979744258
83,Thu Sep 21 20:30:26 +0000 2017,HELMUT LANG,"ELIBEIDY BACKSTAGE at HELMUT LANG seen by SHAYNE OLIVER ©HELMUT LANG, 2017 https://t.co/W3mTso4bOI",910964457018478593
84,Thu Sep 21 20:27:03 +0000 2017,HELMUT LANG,"SARAH BACKSTAGE at HELMUT LANG seen by SHAYNE OLIVER ©HELMUT LANG, 2017 https://t.co/1wOdkC7aj6",910963608682733568
85,Thu Sep 21 20:24:22 +0000 2017,HELMUT LANG,"DASHA BACKSTAGE at HELMUT LANG seen by SHAYNE OLIVER ©HELMUT LANG, 2017 https://t.co/NbdoJUDXHv",910962931101257733
86,Wed Sep 20 17:34:07 +0000 2017,HELMUT LANG,"MEKHI and MATT BACKSTAGE at HELMUT LANG seen by SHAYNE OLIVER ©HELMUT LANG, 2017 https://t.co/7yTDLBndfW",910557700421033985
87,Wed Sep 20 17:18:43 +0000 2017,HELMUT LANG,"SELENA BACKSTAGE at HELMUT LANG seen by SHAYNE OLIVER ©HELMUT LANG, 2017 https://t.co/vIzKKt5vwJ",910553824884150273
88,Wed Sep 20 16:28:02 +0000 2017,HELMUT LANG,"SAM BACKSTAGE at HELMUT LANG seen by SHAYNE OLIVER ©HELMUT LANG, 2017 https://t.co/xxxndngEkB",910541067233169408
89,Tue Sep 19 21:42:58 +0000 2017,HELMUT LANG,"MARJAN and MATT BACKSTAGE at HELMUT LANG seen by SHAYNE OLIVER ©HELMUT LANG, 2017 https://t.co/EV6r4KHkLF",910257935456010246
90,Tue Sep 19 21:41:20 +0000 2017,HELMUT LANG,"BACKSTAGE at HELMUT LANG seen by SHAYNE OLIVER ©HELMUT LANG, 2017 https://t.co/UxakJCSbRX",910257526373052416
91,Tue Sep 19 21:40:22 +0000 2017,HELMUT LANG,"MAEVE BACKSTAGE at HELMUT LANG seen by SHAYNE OLIVER ©HELMUT LANG, 2017 https://t.co/qSqAm6NieZ",910257284072263680
92,Mon Sep 18 15:38:42 +0000 2017,HELMUT LANG,"LOOK 53-54
HELMUT LANG seen by SHAYNE OLIVER
WATCH THE SHOW on https://t.co/TOTCihvkix https://t.co/IPZsrjvtvx",909803875879866368
93,Mon Sep 18 15:38:18 +0000 2017,HELMUT LANG,"LOOK 49-52 
HELMUT LANG seen by SHAYNE OLIVER
WATCH THE SHOW on https://t.co/TOTCihvkix https://t.co/fePF9wB1Ep",909803779272380417
94,Mon Sep 18 15:37:46 +0000 2017,HELMUT LANG,"LOOK 45-48
HELMUT LANG seen by SHAYNE OLIVER
WATCH THE SHOW on https://t.co/TOTCihvkix https://t.co/rs2PZu9Ncg",909803642479415296
95,Mon Sep 18 15:37:15 +0000 2017,HELMUT LANG,"LOOK 41-44
HELMUT LANG seen by SHAYNE OLIVER
WATCH THE SHOW on https://t.co/TOTCihvkix https://t.co/5c9TlSmcsx",909803514045648896
96,Mon Sep 18 15:36:53 +0000 2017,HELMUT LANG,"LOOK 37-40
HELMUT LANG seen by SHAYNE OLIVER
WATCH THE SHOW on https://t.co/TOTCihvkix https://t.co/L1vrcMfL8D",909803418801319936
97,Mon Sep 18 15:36:28 +0000 2017,HELMUT LANG,"LOOK 33-36
HELMUT LANG seen by SHAYNE OLIVER
WATCH THE SHOW on https://t.co/TOTCihvkix https://t.co/LugQ8PBqhi",909803317794152448
98,Mon Sep 18 15:35:57 +0000 2017,HELMUT LANG,"LOOK 29-32
HELMUT LANG seen by SHAYNE OLIVER
WATCH THE SHOW on https://t.co/TOTCihvkix https://t.co/ZG5wxNqQPs",909803185023389697
99,Mon Sep 18 15:33:34 +0000 2017,HELMUT LANG,"LOOK 25-28
HELMUT LANG seen by SHAYNE OLIVER
WATCH THE SHOW on https://t.co/TOTCihvkix https://t.co/qeXfIRJmDE",909802587528065026
100,Mon Sep 18 15:32:52 +0000 2017,HELMUT LANG,"LOOK 21-24
HELMUT LANG seen by SHAYNE OLIVER
WATCH THE SHOW on https://t.co/TOTCihvkix https://t.co/oJ6OplFNci",909802411841159168
101,Mon Sep 18 15:31:52 +0000 2017,HELMUT LANG,"LOOK 17-20
HELMUT LANG seen by SHAYNE OLIVER
WATCH THE SHOW on https://t.co/TOTCihvkix https://t.co/e46pPmnPyJ",909802156265541632
102,Thu Sep 14 21:56:06 +0000 2017,HELMUT LANG,"LOOK 13-16
HELMUT LANG seen by SHAYNE OLIVER
WATCH THE SHOW on https://t.co/TOTCihvkix https://t.co/ozbWnhocgK",908449300513984513
103,Wed Sep 13 20:12:25 +0000 2017,HELMUT LANG,"LOOK 9-12
HELMUT LANG seen by SHAYNE OLIVER
WATCH THE SHOW on https://t.co/TOTCihvkix https://t.co/1sZORaOqnk",908060823720951808
104,Wed Sep 13 18:00:09 +0000 2017,HELMUT LANG,"LOOK 5-8
HELMUT LANG seen by SHAYNE OLIVER
WATCH THE SHOW on https://t.co/TOTCihvkix https://t.co/s1mene1LVI",908027535631503360
105,Wed Sep 13 17:47:54 +0000 2017,HELMUT LANG,"LOOK 1-4
HELMUT LANG seen by SHAYNE OLIVER
WATCH THE SHOW on https://t.co/TOTCihvkix https://t.co/j1bZFsbpxd",908024454336450562
106,Tue Sep 12 20:48:01 +0000 2017,HELMUT LANG,"TOUR MERCH from the HELMUT LANG seen by SHAYNE OLIVER show AVAILABLE NOW at select retailers, HELMUT LANG stores and https://t.co/WRnhACPO2M https://t.co/SJfFXhHhNO",907707391847870464
107,Tue Sep 12 20:37:54 +0000 2017,HELMUT LANG,HELMUT LANG seen by SHAYNE OLIVER. PHOTOGRAPHY Nicolai Howalt STYLING Akeem Smith ©HELMUT LANG 2017 https://t.co/sxulMgUTSJ,907704847948025862
108,Tue Sep 12 16:52:18 +0000 2017,HELMUT LANG,HELMUT LANG seen by SHAYNE OLIVER. PHOTOGRAPHY Nicolai Howalt STYLING Akeem Smith ©HELMUT LANG 2017 https://t.co/T1KgM0qP0H,907648074079760384
109,Tue Sep 12 16:03:22 +0000 2017,HELMUT LANG,"Last night, SHAYNE OLIVER debuted his collection for HELMUT LANG. Today, we introduce the new campaign seen by NICOLAI HOWALT. ©HELMUT LANG https://t.co/Dp2SlO1UZm",907635758508515334
110,Mon Sep 11 19:23:41 +0000 2017,HELMUT LANG,HELMUT LANG seen by SHAYNE OLIVER NYFW show will be streaming LIVE at 9PM EST on Instagram LIVE and https://t.co/WRnhACPO2M https://t.co/sWdA22Ux9u,907323783127736321
111,Mon Sep 11 18:42:41 +0000 2017,HELMUT LANG,HELMUT LANG seen by SHAYNE OLIVER NYFW show will be streaming LIVE at 9PM EST on Instagram LIVE and https://t.co/WRnhACPO2M https://t.co/Pbf026lcSs,907313465051803648
112,Mon Sep 11 15:49:53 +0000 2017,HELMUT LANG,HELMUT LANG seen by SHAYNE OLIVER NYFW show will be streaming LIVE at 9PM EST on Instagram LIVE and https://t.co/WRnhACPO2M https://t.co/B95nPZmIQ8,907269976586964996
113,Mon Sep 11 14:55:32 +0000 2017,HELMUT LANG,HELMUT LANG seen by SHAYNE OLIVER will be STREAMING LIVE ON INSTAGRAM and https://t.co/WRnhACPO2M at 9PM EST https://t.co/d4tuztwlop,907256301599825920
114,Mon Sep 11 14:25:11 +0000 2017,HELMUT LANG,HELMUT LANG seen by ETHAN JAMES GREEN. NICKY wears the COWBOY T-SHIRT and PAINTER JEAN from HELMUT LANG RE-EDITION. https://t.co/WRnhACPO2M https://t.co/xGSeyXO3Jd,907248661704441856
115,Fri Sep 08 21:17:07 +0000 2017,HELMUT LANG,"THE original HELMUT LANG ASTRO JACKET shot by STEVEN MEISEL for VOGUE, July 1999. https://t.co/WRnhACPO2M https://t.co/Qi97Oy5Faw",906265164533596160
116,Fri Sep 08 21:00:49 +0000 2017,HELMUT LANG,THE original COWBOY T-SHIRT shot by JUERGEN TELLER in 2004.  https://t.co/WRnhACPO2M https://t.co/b2F7mVf6r9,906261062252724230
117,Fri Sep 08 20:33:41 +0000 2017,HELMUT LANG,THE HELMUT LANG PAINTER JEAN featured on the cover of NEW ORDER's album GET READY in 2000. Shot by JUERGEN TELLER. https://t.co/WRnhACPO2M https://t.co/2fy7dZD90q,906254232772280320
118,Fri Sep 08 19:12:04 +0000 2017,HELMUT LANG,The HELMUT LANG RE-EDITION COLLECTION is available NOW at select retailers WORLDWIDE and HELMUT LANG STORES + https://t.co/WRnhACPO2M https://t.co/1km1tVAuRJ,906233695027306496
119,Fri Sep 08 19:01:16 +0000 2017,HELMUT LANG,The HELMUT LANG RE-EDITION COLLECTION is available NOW at select retailers WORLDWIDE and HELMUT LANG STORES + https://t.co/WRnhACPO2M https://t.co/XWVNkIrhaV,906230977332224000
120,Fri Sep 08 18:50:14 +0000 2017,HELMUT LANG,The HELMUT LANG RE-EDITION COLLECTION is available NOW at select retailers WORLDWIDE and HELMUT LANG STORES + https://t.co/WRnhACPO2M https://t.co/f6QM1preSG,906228200556167168
