,created,handle,text,tweet_id
121,Thu Sep 07 17:24:44 +0000 2017,HELMUT LANG,The HELMUT LANG RE-EDITION COLLECTION will be available on SEPTEMBER 8 at select retailers and HELMUT LANG STORES + https://t.co/WRnhACPO2M https://t.co/xkD6wNCAB8,905844296926056450
122,Thu Sep 07 17:22:26 +0000 2017,HELMUT LANG,The HELMUT LANG RE-EDITION COLLECTION will be available on SEPTEMBER 8 at select retailers and HELMUT LANG STORES + https://t.co/WRnhACPO2M https://t.co/HiPjnxS9dh,905843716295991297
123,Thu Sep 07 16:57:00 +0000 2017,HELMUT LANG,The HELMUT LANG RE-EDITION COLLECTION will be available on SEPTEMBER 8 at select retailers and HELMUT LANG STORES + https://t.co/WRnhACPO2M https://t.co/rsXNLaYjEv,905837314437505025
124,Wed Sep 06 16:49:31 +0000 2017,HELMUT LANG,The HELMUT LANG RE-EDITION COLLECTION will be available on SEPTEMBER 8 at select retailers and HELMUT LANG STORES + https://t.co/WRnhACPO2M https://t.co/S0ZqHfL9ri,905473046294745089
125,Wed Sep 06 15:55:48 +0000 2017,HELMUT LANG,The HELMUT LANG RE-EDITION COLLECTION will be available on SEPTEMBER 8 at select retailers and HELMUT LANG STORES + https://t.co/WRnhACPO2M https://t.co/Pw8qfSJ5EY,905459525146300416
126,Wed Sep 06 15:17:55 +0000 2017,HELMUT LANG,The HELMUT LANG RE-EDITION COLLECTION will be available on SEPTEMBER 8 at select retailers and HELMUT LANG STORES + https://t.co/WRnhACPO2M https://t.co/xs4Pdf8qsJ,905449991703060480
127,Tue Sep 05 16:28:37 +0000 2017,HELMUT LANG,The HELMUT LANG RE-EDITION COLLECTION will be available on SEPTEMBER 8 at select retailers and HELMUT LANG STORES + https://t.co/WRnhACPO2M https://t.co/SQnRgajlfN,905105397907947520
128,Tue Sep 05 16:24:22 +0000 2017,HELMUT LANG,The HELMUT LANG RE-EDITION COLLECTION will be available on SEPTEMBER 8 at select retailers and HELMUT LANG STORES + https://t.co/WRnhACPO2M https://t.co/gOSE6lmbNW,905104327198560257
129,Tue Sep 05 14:48:45 +0000 2017,HELMUT LANG,The HELMUT LANG RE-EDITION COLLECTION will be available on SEPTEMBER 8 at select retailers and HELMUT LANG STORES + https://t.co/WRnhACPO2M https://t.co/aPBL6WUPrc,905080264942116864
130,Tue Sep 05 13:59:45 +0000 2017,HELMUT LANG,The HELMUT LANG RE-EDITION COLLECTION will be available on SEPTEMBER 8 at select retailers and HELMUT LANG STORES + https://t.co/WRnhACPO2M https://t.co/EagQEWFx3G,905067935449980928
131,Tue Sep 05 13:52:10 +0000 2017,HELMUT LANG,The HELMUT LANG RE-EDITION COLLECTION will be available on SEPTEMBER 8 at select retailers and HELMUT LANG STORES + https://t.co/WRnhACPO2M https://t.co/VND4r1mHyG,905066027704299520
132,Tue Sep 05 13:42:44 +0000 2017,HELMUT LANG,The HELMUT LANG RE-EDITION COLLECTION will be available on SEPTEMBER 8 at select retailers and HELMUT LANG STORES + https://t.co/WRnhACPO2M https://t.co/uTXmyBEpSO,905063653094944768
133,Mon Sep 04 19:41:38 +0000 2017,HELMUT LANG,"HELMUT LANG in VOGUE ITALIA, DECEMBER 1997
PHOTOGRAPHY Steven Meisel
FASHION Brana Wolf 
#HELMUTLANGARCHIVE #LABORDAY https://t.co/GLiE1sUfJh",904791584465719300
134,Mon Sep 04 19:40:59 +0000 2017,HELMUT LANG,"HELMUT LANG in VOGUE PARIS, DECEMBER 2000/JANUARY 2001
PHOTOGRAPHY Tom Munro
FASHION Antje Winter 
#HELMUTLANGARCHIVE #LABORDAY https://t.co/FdblVnDg59",904791421844160514
135,Mon Sep 04 19:40:20 +0000 2017,HELMUT LANG,"HELMUT LANG in HARPERS BAZAAR, FEBRUARY 1998
PHOTOGRAPHY Steven Meisel
FASHION Tonne Goodman
#HELMUTLANGARCHIVE #LABORDAY https://t.co/UFsSKJTXwY",904791255502213121
136,Thu Aug 31 14:39:10 +0000 2017,HELMUT LANG,"HELMUT LANG PVC Bag
AVAILABLE TO THE FIRST 100 SHOPPERS IN OUR NY AND LA STORES
821 WASHINGTON ST, NY
8808 MELROSE AVE, WEST HOLLYWOOD https://t.co/P2hCh3ea55",903265913570336769
137,Thu Aug 31 14:38:06 +0000 2017,HELMUT LANG,"HELMUT LANG PVC Bag
AVAILABLE TO THE FIRST 100 SHOPPERS IN OUR NY AND LA STORES
821 WASHINGTON ST, NY
8808 MELROSE AVE, WEST HOLLYWOOD https://t.co/cHP25GXGV6",903265647374753792
138,Thu Aug 31 14:37:08 +0000 2017,HELMUT LANG,"HELMUT LANG PVC Bag
AVAILABLE TO THE FIRST 100 SHOPPERS IN OUR NY AND LA STORES
821 WASHINGTON ST, NY
8808 MELROSE AVE, WEST HOLLYWOOD https://t.co/tfShwvjCET",903265403777908737
139,Wed Aug 30 22:07:07 +0000 2017,HELMUT LANG,"JOE seen by GRACE AHLBOM for HELMUT LANG JOURNAL
https://t.co/MuTpFZ8tYB https://t.co/N1phhGYLlP",903016255652859927
140,Wed Aug 30 22:06:45 +0000 2017,HELMUT LANG,"JOE seen by GRACE AHLBOM for HELMUT LANG JOURNAL
https://t.co/MuTpFZ8tYB https://t.co/7nPppVJb33",903016163931820040
141,Wed Aug 30 22:06:16 +0000 2017,HELMUT LANG,"JOE seen by GRACE AHLBOM for HELMUT LANG JOURNAL
https://t.co/MuTpFZ8tYB https://t.co/NcxFFhLatU",903016041940471808
142,Tue Aug 29 20:27:31 +0000 2017,HELMUT LANG,"INTRODUCING: The PLEASER BELT by HELMUT LANG 
SHOP FALL NEW ARRIVALS at https://t.co/6t2is9wf0N https://t.co/d5dJd6Vq7n",902628802198593536
143,Fri Aug 25 18:03:31 +0000 2017,HELMUT LANG,"FREE DOMESTIC SHIPPING AND RETURNS
https://t.co/WRnhACPO2M https://t.co/Wou3Um3fIP",901143013241520129
144,Thu Aug 24 19:16:22 +0000 2017,HELMUT LANG,"INTRODUCING: The SHEARLING BOOT by HELMUT LANG 
SHOP FALL NEW ARRIVALS at https://t.co/6t2is9wf0N https://t.co/BJ5eDnfLTl",900798959848837120
145,Thu Aug 24 16:07:56 +0000 2017,HELMUT LANG,"INTRODUCING: The ST MARKS BELT by HELMUT LANG 
SHOP FALL NEW ARRIVALS at https://t.co/6t2is9eE9f https://t.co/3G2sYBOJ1f",900751537902845954
146,Wed Aug 23 19:01:41 +0000 2017,HELMUT LANG,"INTRODUCING: The TORTOISE FAUX FUR COAT by HELMUT LANG
SHOP FALL NEW ARRIVALS at https://t.co/6t2is9eE9f https://t.co/jWW1b4gB6x",900432877825011712
147,Wed Aug 23 18:15:20 +0000 2017,HELMUT LANG,"INTRODUCING: The BLAZER DRESS by HELMUT LANG 
SHOP FALL NEW ARRIVALS at https://t.co/6t2is9eE9f https://t.co/fqeMWRLaqb",900421211989184512
148,Wed Aug 23 17:32:18 +0000 2017,HELMUT LANG,"INTRODUCING: The GRUNGE KNIT by HELMUT LANG 
SHOP FALL NEW ARRIVALS at https://t.co/6t2is9eE9f https://t.co/Bu4l79uPQT",900410381822197765
149,Tue Aug 22 17:54:19 +0000 2017,HELMUT LANG,CUIRON: The original scent by HELMUT LANG. First issued in 2002. SHOP NOW at https://t.co/a5I6iSFUO2 https://t.co/bh7CYpHJos,900053532598038528
150,Tue Aug 22 16:21:07 +0000 2017,HELMUT LANG,EAU DE COLOGNE: The original scent by HELMUT LANG. First issued in 2000. SHOP NOW at https://t.co/a5I6iSFUO2 https://t.co/cg4NrNEw5Y,900030080688283648
151,Tue Aug 22 15:31:56 +0000 2017,HELMUT LANG,EAU DE PARFUM: The original scent by HELMUT LANG. First issued in 2000.  SHOP NOW at https://t.co/a5I6iSFUO2 https://t.co/MSCJftbRYd,900017702508613632
152,Mon Aug 21 20:25:34 +0000 2017,HELMUT LANG,"HELMUT LANG in @AnOtherMagazine, 2003
Photography @Terry_World 
Fashion Sabina Schreder
#HELMUTLANGARCHIVE https://t.co/Aas0AdAaNS",899729210490707968
153,Mon Aug 21 17:30:43 +0000 2017,HELMUT LANG,"HELMUT LANG x LOUIS VUITTON, 1996
#HELMUTLANGARCHIVE https://t.co/0Q3GPt0M7k",899685206344511488
154,Fri Aug 18 15:43:16 +0000 2017,HELMUT LANG,"SHOP FALL NEW ARRIVALS
https://t.co/6t2is9eE9f https://t.co/SPrnMNuT2A",898571004997402624
155,Fri Aug 18 15:42:54 +0000 2017,HELMUT LANG,"SHOP FALL NEW ARRIVALS
https://t.co/6t2is9eE9f https://t.co/RUB8Pa2Dav",898570910017482752
156,Fri Aug 18 14:23:31 +0000 2017,HELMUT LANG,"SHOP FALL NEW ARRIVALS
https://t.co/6t2is9eE9f https://t.co/STam4ocbHv",898550932765638662
157,Thu Aug 17 20:54:09 +0000 2017,HELMUT LANG,"WEAR HELMUT LANG
SHOP FALL NOW
https://t.co/WRnhACycEc https://t.co/dGIzOmDYFL",898286851349295104
158,Wed Aug 16 20:03:24 +0000 2017,HELMUT LANG,"©HELMUT LANG 
https://t.co/WRnhACPO2M https://t.co/RkrKB6nZvM",897911693921091584
159,Wed Aug 16 15:25:02 +0000 2017,HELMUT LANG,"©HELMUT LANG 
https://t.co/WRnhACPO2M https://t.co/ZVoekPE5ZJ",897841640186007553
160,Tue Aug 15 17:08:56 +0000 2017,HELMUT LANG,"TRACI LORDS in DETAILS MAGAZINE, fully outfitted by HELMUT LANG.
READ TRACI’s FULL INTERVIEW by PATRIK SANDBERG:
https://t.co/MuTpFZ8tYB https://t.co/AdnboOsch1",897505398474887168
161,Tue Aug 15 17:07:46 +0000 2017,HELMUT LANG,"TRACI LORDS in DETAILS MAGAZINE, fully outfitted by HELMUT LANG.
READ TRACI’s FULL INTERVIEW by PATRIK SANDBERG:
https://t.co/MuTpFZ8tYB https://t.co/2BlguZbMLR",897505103829245952
162,Tue Aug 15 14:35:46 +0000 2017,HELMUT LANG,"HELMUT LANG campaign star TRACI LORDS in DETAILS MAGAZINE, 1995, outfitted by HELMUT LANG. PHOTOGRAPHY Albert Watson STYLING Bill Mullen https://t.co/4knEAWirCG",897466852020015108
163,Tue Aug 15 13:54:54 +0000 2017,HELMUT LANG,"INTRODUCING: The HELMUT LANG Trash Bag — WARNING: THIS BAG IS NOT A TOY
https://t.co/D4okvLRgqU https://t.co/do3Uyl0GVS",897456567263670272
164,Mon Aug 14 17:16:30 +0000 2017,HELMUT LANG,INTRODUCING: The HELMUT LANG Trash Bag — **DISCLAIMER** STORING TRASH IS NOT ADVISED https://t.co/oFm1D5DCcD,897144914479329281
165,Mon Aug 14 13:59:42 +0000 2017,HELMUT LANG,"INTRODUCING: The HELMUT LANG Trash Bag — The Bag You Need In Your Life
https://t.co/WRnhACPO2M https://t.co/TzxnDaDyy4",897095390092308482
166,Fri Aug 11 20:29:34 +0000 2017,HELMUT LANG,"VISIT US AT HELMUT LANG, 8808 MELROSE AVE, HOLLYWOOD, CA 90069 https://t.co/41Idn1kV5f",896106337037303808
167,Fri Aug 11 20:26:36 +0000 2017,HELMUT LANG,"First exhibited at this year's WHITNEY BIENNIAL, Herman's Dress, 2017 by JESSI REAVES has found a new home at HELMUT LANG NEW YORK https://t.co/vf9zscRp6k",896105593164898306
168,Fri Aug 11 20:24:12 +0000 2017,HELMUT LANG,"VISIT US AT HELMUT LANG, 821 WASHINGTON ST, NEW YORK, NY 10014 https://t.co/GdWF23uHpy",896104988404875264
169,Thu Aug 10 19:47:30 +0000 2017,HELMUT LANG,"INTRODUCING: The Leather Biker Trench
SHOP HELMUT LANG A/W 17 NOW:
https://t.co/tdHgDtI4v1…/womens-new,default,sc.html https://t.co/N9TYJR5y33",895733363738157057
170,Thu Aug 10 17:10:46 +0000 2017,HELMUT LANG,Discover the SECRET HISTORY behind WALTER PFEIFFER'S works in THE ARTIST SERIES on the HELMUT LANG Journal now: https://t.co/S3ymd6S9o8 https://t.co/GCaaacSU9n,895693922063732736
171,Thu Aug 10 15:43:25 +0000 2017,HELMUT LANG,RT @CRFASHIONBOOK: Helmut Lang Launches a Year-Long Artist Series Project https://t.co/oY1Qs73LpK,895671940056322048
172,Thu Aug 10 13:51:27 +0000 2017,HELMUT LANG,"WALTER PFEIFFER is the first artist launching HELMUT LANG: THE ARTIST SERIES in OCTOBER, 2017. https://t.co/OgqFqG3f0U",895643759794282497
173,Wed Aug 09 18:01:26 +0000 2017,HELMUT LANG,RT @AnotherMan: The photographer who defined the New York underground: https://t.co/X29b3g6Heu https://t.co/Gp2bVvf1Zx,895344282491604997
174,Wed Aug 09 17:50:16 +0000 2017,HELMUT LANG,"WALTER PFEIFFER is the first artist launching HELMUT LANG: THE ARTIST SERIES in OCTOBER, 2017. https://t.co/AouPBIYFd8",895341474761539584
175,Tue Aug 08 13:30:35 +0000 2017,HELMUT LANG,"RT @wmag: Inside @HelmutLang 2.0, the re-invention of the 1990s' most influential label: https://t.co/s3Nsvbslge https://t.co/SgccZ97ym8",894913733062995969
176,Tue Aug 08 13:30:14 +0000 2017,HELMUT LANG,"WALTER PFEIFFER is the first artist launching HELMUT LANG: THE ARTIST SERIES in OCTOBER, 2017. https://t.co/3JLhUJu9w7",894913647620784128
177,Mon Aug 07 18:23:02 +0000 2017,HELMUT LANG,"HELMUT LANG SEEN BY: THE ARTIST SERIES is a year-long program featuring 12 visual artists. Coming OCTOBER, 2017. https://t.co/2lLSJ9jv0i",894624945002643456
178,Fri Aug 04 15:52:53 +0000 2017,HELMUT LANG,"HELMUT LANG RE-EDITION sees the re-issue of important heritage HELMUT LANG pieces. VOLUME 1 launching SEPTEMBER 8, 2017. https://t.co/2agE6MKyTJ",893499993658720261
179,Thu Aug 03 17:05:02 +0000 2017,HELMUT LANG,SAVE THE DATE: HELMUT LANG seen by SHAYNE OLIVER coming SEPTEMBER 11 https://t.co/rySavS14VU,893155763534909440
180,Wed Aug 02 14:44:22 +0000 2017,HELMUT LANG,NICKY RAT seen by ETHAN JAMES GREEN ©HELMUT LANG 2017 https://t.co/HAdRs0Hdfb,892757976670511105
181,Wed Aug 02 14:43:54 +0000 2017,HELMUT LANG,YOSHI seen by ETHAN JAMES GREEN ©HELMUT LANG 2017 https://t.co/kCvivCy8Rk,892757857602547712
182,Wed Aug 02 14:40:55 +0000 2017,HELMUT LANG,ALEK WEK seen by ETHAN JAMES GREEN ©HELMUT LANG 2017 https://t.co/9kL0vGhKap,892757107266789376
183,Tue Aug 01 14:53:23 +0000 2017,HELMUT LANG,KEMBRA and NICKY seen by ETHAN JAMES GREEN ©HELMUT LANG 2017 https://t.co/hL6QFhiTx8,892397854521741313
184,Tue Aug 01 14:52:21 +0000 2017,HELMUT LANG,GRACE GEE seen by ETHAN JAMES GREEN ©HELMUT LANG 2017 https://t.co/PVMvoaEk2l,892397595502534656
185,Tue Aug 01 14:50:17 +0000 2017,HELMUT LANG,UNLOCKING THE TRUTH seen by ETHAN JAMES GREEN ©HELMUT LANG 2017 https://t.co/CwawT6ggH8,892397077879287808
186,Mon Jul 31 20:06:05 +0000 2017,HELMUT LANG,SOHYUN and ALANIE seen by ETHAN JAMES GREEN ©HELMUT LANG 2017 https://t.co/7FWQOa3Hza,892114163434213377
187,Mon Jul 31 20:05:26 +0000 2017,HELMUT LANG,LARRY CLARK seen by ETHAN JAMES GREEN ©HELMUT LANG 2017 https://t.co/IgP4ZXrncQ,892113996467363842
188,Mon Jul 31 20:04:23 +0000 2017,HELMUT LANG,SHAYNE and IAN seen by ETHAN JAMES GREEN ©HELMUT LANG 2017 https://t.co/lY79DNJZwV,892113734335856645
189,Fri Jul 28 14:47:27 +0000 2017,HELMUT LANG,"TRACI LORDS seen by ETHAN JAMES GREEN 
©HELMUT LANG 2017 https://t.co/BhIuCaOufg",890946810277187585
190,Fri Jul 28 14:46:47 +0000 2017,HELMUT LANG,"AUREL, MARI and ALEK seen by ETHAN JAMES GREEN 
©HELMUT LANG 2017 https://t.co/5gzLfNIsFa",890946643675238400
191,Fri Jul 28 14:45:47 +0000 2017,HELMUT LANG,"ALANIE seen by ETHAN JAMES GREEN 
©HELMUT LANG 2017 https://t.co/WTuswYunFl",890946391547269120
192,Thu Jul 27 14:07:44 +0000 2017,HELMUT LANG,"LARRY CLARK seen by ETHAN JAMES GREEN
©HELMUT LANG 2017 https://t.co/CwPobWWjOn",890574429281038341
193,Thu Jul 27 14:05:55 +0000 2017,HELMUT LANG,"KEMBRA PFAHLER seen by ETHAN JAMES GREEN
©HELMUT LANG 2017 https://t.co/JRvK7YLKd6",890573971447574528
194,Thu Jul 27 13:53:13 +0000 2017,HELMUT LANG,"MARI COPENY aka LITTLE MISS FLINT seen by ETHAN JAMES GREEN
©HELMUT LANG 2017 https://t.co/L2o4TROARc",890570777069834246
195,Wed Jul 26 21:12:33 +0000 2017,HELMUT LANG,"GOGO and TRACI seen by ETHAN JAMES GREEN
©HELMUT LANG 2017 https://t.co/o2vYRL8Pse",890318950025842688
196,Wed Jul 26 20:58:35 +0000 2017,HELMUT LANG,"CHRIS KRAUS seen by ETHAN JAMES GREEN
©HELMUT LANG 2017 https://t.co/12Wh46thHW",890315435509526530
197,Wed Jul 26 19:16:53 +0000 2017,HELMUT LANG,"YOSHI and DARA seen by ETHAN JAMES GREEN
©HELMUT LANG 2017 https://t.co/I2dO0EUgs7",890289841233068033
198,Tue Jul 25 17:00:55 +0000 2017,HELMUT LANG,"YOSHI seen by ETHAN JAMES GREEN
©HELMUT LANG 2017 https://t.co/F7XZPkC1rw",889893234423590912
199,Tue Jul 25 16:31:35 +0000 2017,HELMUT LANG,"ALEK WEK seen by ETHAN JAMES GREEN
©HELMUT LANG 2017 https://t.co/ojQa12dxv4",889885853694267392
200,Tue Jul 25 15:51:50 +0000 2017,HELMUT LANG,"TRACI LORDS seen by ETHAN JAMES GREEN
©HELMUT LANG 2017 https://t.co/FHID7TiL81",889875848567943168
201,Tue Jul 25 15:29:22 +0000 2017,HELMUT LANG,"SHAYNE OLIVER seen by ETHAN JAMES GREEN
©HELMUT LANG 2017 https://t.co/rKRO5bNwWh",889870198068711424
202,Tue Jul 25 15:06:58 +0000 2017,HELMUT LANG,"DARA and ALEK WEK seen by ETHAN JAMES GREEN
©HELMUT LANG 2017 https://t.co/lPv6K8Y0jc",889864560420823040
203,Tue Jul 25 14:47:12 +0000 2017,HELMUT LANG,"NICKY RAT seen by ETHAN JAMES GREEN
©HELMUT LANG 2017 https://t.co/mDK9sBgwCi",889859584093024257
204,Mon Jul 24 20:00:13 +0000 2017,HELMUT LANG,"TOMORROW.
https://t.co/WRnhACPO2M",889575972382658562
205,Mon Jul 24 14:04:10 +0000 2017,HELMUT LANG,"IMPRESS YOUR PARENTS wear helmut lang
© HELMUT LANG",889486367100723201
206,Mon Jul 24 13:56:32 +0000 2017,HELMUT LANG,"WARNING: Lack of charisma could be fatal. 
© HELMUT LANG All jokes reserved.",889484444930854913
207,Mon Jul 24 13:42:07 +0000 2017,HELMUT LANG,"The only COMPANY that cares for YOU
© HELMUT LANG",889480816258146305
