,created,handle,text,tweet_id
613,Wed May 24 14:49:03 +0000 2017,Alexander McQueen,See @ellefanning wearing a #McQueenPreAW17 dove cotton jacquard dress and floral embroidered platform sandals @Festival_Cannes #Cannes2017 https://t.co/i17KQFxN9F,867392001175584768
614,Wed May 24 14:43:02 +0000 2017,Alexander McQueen,#NicoleKidman wearing a #McQueenAW17 marble pink iris lace dress with glass bead embroidery @Festival_Cannes #SeenInMcQueen #Cannes2017 https://t.co/IHWm3c8qwu,867390488772521984
615,Wed May 24 11:03:36 +0000 2017,Alexander McQueen,CLOSE-UP: The metallic embroidery featured on the dress worn by @jes_chastain at @Festival_Cannes . #McQueenDetail #McQueenCraft https://t.co/4IsWZ0Vkrg,867335267476275204
616,Wed May 24 09:59:04 +0000 2017,Alexander McQueen,"See @jes_chastain in a #McQueenPreAW17 dress with a beaded, crystal embroidered phoenix and the #McQueenBoxBag @Festival_Cannes #Cannes70 https://t.co/2RPepXHpXx",867319025713500161
617,Mon May 22 21:19:31 +0000 2017,Alexander McQueen,The new Box Bag in ginger. Discover the array of new colours: https://t.co/T7ajgHSw9F https://t.co/7asaigIYUO,866765492794662912
618,Mon May 22 17:38:07 +0000 2017,Alexander McQueen,"The new Box Bag in flame. Explore all the colours: https://t.co/T7ajgHAUL5 
#McQueenBoxBag #AlexanderMcQueen https://t.co/tkawHg5KFw",866709774829731840
619,Mon May 22 06:12:52 +0000 2017,Alexander McQueen,"IN DETAIL: the tree of life and eagle embroidered in metal sequins, bugle beads, glass beads and stones. #McQueenPreAW17 https://t.co/x2G4Z1pR5e",866537324766801920
620,Sun May 21 07:13:31 +0000 2017,Alexander McQueen,A drawing of an eagle in flight created during the design process for #McQueenPreAW17 Explore the collection: https://t.co/ce8jq2BgnA https://t.co/jpZHMKi1qZ,866190199356878848
621,Sat May 20 22:07:32 +0000 2017,Alexander McQueen,"Inspired by the tree of life, this hand embroidered dress features metal sequins, bugle beads, glass beads and stones. #McQueenPreAW17 https://t.co/USgqA44gHY",866052800912011264
622,Sat May 20 08:56:30 +0000 2017,Alexander McQueen,See @_juliannemoore in a #McQueenPreAW17 black velvet dress with sculpted sleeves and satin borders @Festival_Cannes #SeenInMcQueen https://t.co/1qPHT5bAJ6,865853728355700736
623,Fri May 19 14:04:48 +0000 2017,Alexander McQueen,"A tuxedo jacket is tailored to give a soft, sculptural asymmetric drape and worn with loose fit trousers: Explore: https://t.co/ce8jq2BgnA https://t.co/GPTFJYH8yq",865568926574538753
624,Thu May 18 16:46:11 +0000 2017,Alexander McQueen,A 'Hepworth' inspired knit dress with juxtaposed organic wave panels. Explore: https://t.co/ce8jq2BgnA #McQueenPreAW17 https://t.co/JqqbgfJ9LL,865247152909541378
625,Wed May 17 21:19:39 +0000 2017,Alexander McQueen,"A close-up of the dress worn by @jes_chastain @Festival_Cannes, engineered and hand-stitched to echo medieval embroidery. #McQueenDetail https://t.co/IdSF99IOJR",864953584462557184
626,Wed May 17 19:57:29 +0000 2017,Alexander McQueen,See @jes_chastain in a Pre AW17 satin-stitch medieval embroidery bustier dress at the opening of @Festival_Cannes #SeenInMcQueen #Cannes70 https://t.co/EEvv9emYdT,864932907298811904
627,Tue May 16 21:35:27 +0000 2017,Alexander McQueen,"Inspiration behind #McQueenPreAW17: Barbara Hepworth at work in St Ives, Cornwall, 1963. Photo Val Wilmer ©Bowness @Tate_StIves https://t.co/sGsBX8HsVW",864595174353141760
628,Tue May 16 17:35:54 +0000 2017,Alexander McQueen,"Fitted with fluid lines, a knit dress inspired by the work of British abstract sculptors. See more: https://t.co/ce8jq2BgnA #McQueenPreAW17 https://t.co/ZdcdS7nIJr",864534890817171457
629,Mon May 15 13:43:19 +0000 2017,Alexander McQueen,"Introducing #McQueenPreAW17, inspired by British abstract sculpture and the mythical landscape of Cornwall: https://t.co/ce8jq2BgnA https://t.co/Ei9x6LzRL6",864113971498016770
630,Sun May 14 21:47:01 +0000 2017,Alexander McQueen,The 'Shipwreck' and 'Silver Wave' dresses; the finale of the SS17 show. #McQueenSS17 https://t.co/QeXhjwEX5U,863873308147765248
631,Sun May 14 21:46:06 +0000 2017,Alexander McQueen,Working on the final embroidered details of the SS17 'Shipwreck' dress. #McQueenSS17 #SirDonMcCullin https://t.co/rRbBEwJ4fe,863873077960200192
632,Sun May 14 09:39:13 +0000 2017,Alexander McQueen,"The Silver Wave sequin embroidered dress, the finale of the #McQueenSS17 show. https://t.co/V6WCVwb5j0",863690150198509569
633,Sat May 13 21:02:34 +0000 2017,Alexander McQueen,Fittings in the atelier: the thistle print cotton voile dress worn with a jewelled and studded harness. #McQueenSS17 #SirDonMcCullin https://t.co/KNwkne5MHI,863499732819357702
634,Sat May 13 11:04:00 +0000 2017,Alexander McQueen,An antique silver and gold Celtic inspired earring with island floral engravings. Discover SS17 jewellery: https://t.co/kLK4ZDvpJG https://t.co/VFd7iLs5Wv,863349099755696128
635,Fri May 12 22:22:11 +0000 2017,Alexander McQueen,Shetland sea birds and coastal plants are embroidered in the atelier. Photograph by Sir Don McCullin. #McQueenSS17 #SirDonMcCullin https://t.co/TiMDPh9p4C,863157383706673152
636,Fri May 12 16:05:30 +0000 2017,Alexander McQueen,In the atelier: #riannevanrompaey in a fitting for the #McQueenSS17 'Sea Creature' dress. Photograph by #SirDonMcCullin https://t.co/aYzWSB7WHe,863062586450956289
637,Thu May 11 16:33:02 +0000 2017,Alexander McQueen,An embroidered leather corset is pieced and panelled with chain stitch and beaded lace. See more of #McQueenSS17 : https://t.co/u2xM0ddqQu https://t.co/SaztzPobh0,862707130884915200
638,Wed May 10 17:30:45 +0000 2017,Alexander McQueen,In @VogueMagazine @ElleFanning wears a custom made washed silk taffeta rose jacquard dress. @AnnieLeibovitz #GraceCoddington https://t.co/IWKlqR44ML,862359263884312576
639,Tue May 09 16:41:23 +0000 2017,Alexander McQueen,The Cut Lens sunglasses as seen in the #McQueenSS17 campaign. Shop new McQueen eyewear: https://t.co/SxJDoYXcxb https://t.co/QK1lFe0hRg,861984455396909056
640,Mon May 08 17:26:42 +0000 2017,Alexander McQueen,A detail from the 'Sea Creature' dress: a Shetland Island brown crab and scallop are hand-drawn and embroidered in black jet. https://t.co/rel1V3a3rj,861633472263319553
641,Mon May 08 16:49:01 +0000 2017,Alexander McQueen,"A ship on the crashing waves of the Shetland Islands, inspired by etchings and embroidered in black jet and sequins. #McQueenSS17 https://t.co/XqyQocMKss",861623986949640192
642,Mon May 08 16:46:04 +0000 2017,Alexander McQueen,An octopus native to the Shetland islands is rendered in black jet work and hand-embroidered onto the 'Sea Creature' dress. #McQueenSS17 https://t.co/cgiTkKO218,861623246843785217
643,Sun May 07 08:26:41 +0000 2017,Alexander McQueen,A Shetland seascape is embroidered onto an ivory tulle base using a mixture of jet techniques. #McQueenSS17 https://t.co/ZSD5v4KY1v,861135182727872512
644,Sat May 06 11:28:02 +0000 2017,Alexander McQueen,"Seahorses, mussels, scallops and brown crabs are embroidered by hand onto the #McQueenSS17 'Sea Creature' dress. https://t.co/wBOm9xWHn7",860818435831451648
645,Fri May 05 16:30:33 +0000 2017,Alexander McQueen,"The gannet, puffin and heron are some of the Shetland birds that feature on this dress. Explore #McQueenSS17 : https://t.co/u2xM0ddqQu https://t.co/s5MLFoMndO",860532177762648064
646,Fri May 05 13:15:38 +0000 2017,Alexander McQueen,Shetland birds and flowers are depicted using a mixture of jet embroidery techniques. Explore #McQueenSS17 : https://t.co/u2xM0ddqQu https://t.co/r3wFITad1c,860483126186975233
647,Thu May 04 17:12:32 +0000 2017,Alexander McQueen,A jet beaded 'Shetland landscape' evening dress showing the flora and fauna of the islands. Explore #McQueenSS17 : https://t.co/u2xM0ddqQu https://t.co/KxwavoZSep,860180355860631553
648,Thu May 04 13:30:55 +0000 2017,Alexander McQueen,A black jet beaded 'Shetland landscape' evening dress at the SS17 show. Explore #McQueenSS17 : https://t.co/u2xM0ddqQu https://t.co/SLDDchgwLw,860124581138493440
649,Wed May 03 17:27:00 +0000 2017,Alexander McQueen,A #McQueenSS17 dress featuring mesh in different scales and jet beaded loose and looped fringes giving the illusion of tangled fishing nets. https://t.co/bqbsJR7xAX,859821607094824960
650,Wed May 03 15:23:35 +0000 2017,Alexander McQueen,An embroidered fishnet bustier dress with jet beaded loose and looped fringes. Explore #McQueenSS17 : https://t.co/u2xM0ddqQu https://t.co/I320seCQCD,859790548307251201
651,Tue May 02 09:48:21 +0000 2017,Alexander McQueen,See #BeeShaffer in a custom ivory heritage patchwork jacquard evening dress with ivory feather stitching at the #MetGala #SeenInMcQueen https://t.co/1MXPej3p6S,859343794491338752
652,Sat Apr 29 13:09:44 +0000 2017,Alexander McQueen,Island flowers embroidered on tulle with a jewelled and engraved belt. See more of #McQueenSS17 : https://t.co/u2xM0ddqQu https://t.co/rgwPPlEkf1,858307310950772740
653,Sat Apr 29 06:59:35 +0000 2017,Alexander McQueen,A floral bouquet organza dress with an embroidered overlay worn with a jewelled and engraved belt. Explore SS17: https://t.co/u2xM0ddqQu https://t.co/zyTy6iVC6X,858214159690936320
654,Fri Apr 28 16:23:20 +0000 2017,Alexander McQueen,Island bouquet ruffles and Celtic inspired jewellery. Explore #McQueenSS17: https://t.co/u2xM0ddqQu https://t.co/gD4rwBDYQj,857993647148732416
655,Wed Apr 26 19:03:30 +0000 2017,Alexander McQueen,Island florals backstage at the SS17 show. Explore #McQueenSS17: https://t.co/u2xM0ddqQu https://t.co/oh2BuNC0Wo,857309177324204033
656,Wed Apr 26 18:58:01 +0000 2017,Alexander McQueen,"A leather frock coat, pieced and panelled with hand-painted, embroidered and printed flowers. Explore #McQueenSS17: https://t.co/u2xM0ddqQu https://t.co/ZbpHxmslRX",857307798752854017
657,Tue Apr 25 15:08:20 +0000 2017,Alexander McQueen,In the atelier: hand-painting floral motifs onto a leather frock coat. Explore #McQueenSS17: https://t.co/u2xM0ddqQu https://t.co/JRpufCnjAi,856887605694259200
658,Mon Apr 24 16:24:52 +0000 2017,Alexander McQueen,An SS17 hand-painted floral leather biker jacket with a 3D floral embroidered dress. Explore SS17: https://t.co/u2xM0ddqQu https://t.co/5ZDKs3mKKY,856544482015293441
659,Sat Apr 22 08:30:08 +0000 2017,Alexander McQueen,An embroidery and jacquard leather frock coat worn over a silk and organza floral dress. Explore SS17: https://t.co/u2xM0ddqQu https://t.co/jQOPqomk21,855700232700559361
660,Thu Apr 20 16:06:28 +0000 2017,Alexander McQueen,"The #McQueenBoxBag is versatile in design and can be worn cross-body, over-the-shoulder or as a clutch. Explore: https://t.co/T7ajgHSw9F https://t.co/5aHru2lVId",855090296413138945
661,Thu Apr 20 11:01:52 +0000 2017,Alexander McQueen,"Introducing the #AlexanderMcQueen Box Bag, inspired by antique luggage and treasure chests. See more: https://t.co/T7ajgHSw9F #McQueenBoxBag https://t.co/EnmBDUcsQ0",855013643116826624
662,Wed Apr 19 17:01:57 +0000 2017,Alexander McQueen,A fishnet inspired top with black jet embroidery and fringing. #McQueenSS17 #AlexanderMcQueen https://t.co/ySut7nGVcJ,854741870890684416
663,Mon Apr 17 10:45:09 +0000 2017,Alexander McQueen,Thistle and floral thread work is hand-stitched onto the bodice of a dress. Explore SS17: https://t.co/u2xM0ddqQu https://t.co/BqAZTvk3wL,853922272461160448
664,Sun Apr 16 09:43:09 +0000 2017,Alexander McQueen,Floral patchwork leather hobnail boots worn with a knitted lace dress. Explore: https://t.co/6b3k9QSvlx #McQueenSS17 https://t.co/eVRAOtd0YN,853544279704297473
665,Sat Apr 15 09:18:46 +0000 2017,Alexander McQueen,"Celtic-inspired bracelets and floral embroidered leather ruffles. Explore: https://t.co/u2xM0ddqQu 
#McQueenSS17 https://t.co/dKmxrp7j0Q",853175758914809856
666,Fri Apr 14 09:26:08 +0000 2017,Alexander McQueen,Knee high hobnail boots with printed &amp; embroidered coastal flowers. See more: https://t.co/6b3k9Ra6d5 #McQueenSS17 https://t.co/pDG1AmOn4g,852815225036316676
667,Thu Apr 13 18:31:09 +0000 2017,Alexander McQueen,In the atelier: Hobnail boots with steel toecaps. See more: https://t.co/6b3k9QSvlx  #McQueenSS17 #AlexanderMcQueen https://t.co/ZKefT2YTUT,852589994325757952
668,Thu Apr 13 15:36:44 +0000 2017,Alexander McQueen,"The Hobnail Boot, inspired by heavy-duty Scottish walking boots. See more: https://t.co/6b3k9QSvlx  #McQueenSS17 #AlexanderMcQueen https://t.co/gqZOw9Z3YO",852546101332910080
669,Wed Apr 12 17:34:32 +0000 2017,Alexander McQueen,"Introducing the piercing shield sunglasses, as seen in the SS17 campaign.  Explore: https://t.co/SxJDoYXcxb #McQueenSS17 #AlexanderMcQueen https://t.co/q9txSh4uYG",852213359114162176
670,Tue Apr 11 13:28:54 +0000 2017,Alexander McQueen,"As seen on the cover of @VogueParis, @VittoCeretti wears the #McQueenSS17 fishnet lace knitted dress and leather corset belt. https://t.co/pc3pv518Rq",851789154098786304
671,Mon Apr 10 21:34:44 +0000 2017,Alexander McQueen,A corseted dress made from a gossamer fine Shetland–inspired lace. Photograph by Sir Don McCullin. #McQueenSS17 https://t.co/6UiiSu8okF,851549031998386177
672,Sun Apr 09 14:12:25 +0000 2017,Alexander McQueen,Finale from the SS17 show at the Orangerie du Sénat in Paris. #McQueenSS17 #SirDonMcCullin #AlexanderMcQueen https://t.co/VpMofKSXTW,851075329447874562
673,Sun Apr 09 09:08:58 +0000 2017,Alexander McQueen,"A close-up of 3-D floral embroidery, each flower hand-stitched individually on tulle. #McQueenSS17 #AlexanderMcQueen https://t.co/zoH23Nr3sb",850998965910810624
674,Sat Apr 08 10:06:39 +0000 2017,Alexander McQueen,Island floral bouquets printed on organza ruffles. #McQueenSS17 #AlexanderMcQueen https://t.co/Cnz0Ap9eBd,850651094044876800
675,Fri Apr 07 16:07:26 +0000 2017,Alexander McQueen,3-D wild coastal flowers hand-stitched on tulle. #McQueenSS17 #AlexanderMcQueen #McQueenDetail https://t.co/rzrBl5wg9K,850379500017811456
676,Thu Apr 06 16:03:21 +0000 2017,Alexander McQueen,"A #McQueenSS17 suit jacket with jet beading details, worn with pieced and panelled macramé trousers. Explore: https://t.co/odmZI1UvAj https://t.co/CRZR2ZaFZb",850016083650256899
677,Thu Apr 06 11:18:46 +0000 2017,Alexander McQueen,Backstage at the #McQueenSS17 show: a velvet rose jacquard jacket with jet beaded embroidery. Explore: https://t.co/odmZI1UvAj https://t.co/2Dv5zZFK5H,849944465624137728
678,Thu Apr 06 07:54:34 +0000 2017,Alexander McQueen,A #McQueenSS17 studded leather harness worn with a cotton voile ditsy floral print dress. See more: https://t.co/4YBYYRnDad https://t.co/KwS36ILOyO,849893076118228992
679,Tue Apr 04 17:26:25 +0000 2017,Alexander McQueen,"Island bouquet printed ruffles and intricately stitched 3D flowers on tulle, worn with the Hobnail boot. #McQueenSS17 #AlexanderMcQueen https://t.co/ruHgGxEnbw",849312211336138752
680,Mon Apr 03 19:27:05 +0000 2017,Alexander McQueen,The #McQueenSS17 jewelled and studded leather harness with Celtic inspired engraved bells worn over the thistle print cotton voile dress. https://t.co/tzKrObEPw9,848980190344687617
681,Mon Apr 03 15:48:42 +0000 2017,Alexander McQueen,See #NicoleKidman wearing a #McQueenAW17 bullion lattice embroidery and medieval flora &amp; fauna dress to the #ACMS #SeenInMcQueen https://t.co/nU0c62CNDy,848925232144449536
682,Sun Apr 02 14:01:33 +0000 2017,Alexander McQueen,Jewelled and engraved cuffs and hand jewellery with a cotton voile thistle print dress. #McQueenSS17 #AlexanderMcQueen https://t.co/U0dIDQjvvW,848535880654401537
683,Sat Apr 01 12:33:59 +0000 2017,Alexander McQueen,Seen in the atelier: an island bouquet print ruffle dress. Photograph by Sir Don McCullin. #McQueenSS17 #SirDonMcCullin https://t.co/fvlrp3mlgZ,848151453848010753
684,Fri Mar 31 16:24:31 +0000 2017,Alexander McQueen,The #AlexanderMcQueen SS17 paisley print silk dress features cut outs and a feminine puffed shoulder. Explore: https://t.co/vWNhaYxBi4 https://t.co/A5Tit8xLGr,847847084883574789
685,Thu Mar 30 17:04:33 +0000 2017,Alexander McQueen,Seen at the #AlexanderMcQueen SS17 show: An engineered paisley silk dress worn with a studded leather harness. #McQueenSS17 https://t.co/Isqw7LwggR,847494768615604225
686,Wed Mar 29 16:58:47 +0000 2017,Alexander McQueen,"An #AlexanderMcQueen bias cut lace dress, worn by Stella Tennant for her first shoot with @BritishVogue in 1993. #ChatsworthHouseStyle https://t.co/ANpvImgLg9",847130929751609344
687,Tue Mar 28 17:16:23 +0000 2017,Alexander McQueen,See #JessicaChastain wearing an #AlexanderMcQueen Pre AW17 Lilypad velvet jacquard dress to the ‘Zookeeper’s Wife’ LA premiere. https://t.co/7WZRQ95upm,846772972249661441
688,Mon Mar 27 14:10:13 +0000 2017,Alexander McQueen,"Featured on the cover of Another Magazine, Mia Goth wearing the #McQueenSS17 mesh corset embellished with jet beaded tassels and fringing. https://t.co/PyiGMEed1n",846363734025146369
689,Sun Mar 26 16:02:20 +0000 2017,Alexander McQueen,"Antique silver and gold Celtic inspired jewellery with floral engravings and metal ball adornments.
#AlexanderMcQueen #McQueenSS17 https://t.co/JKtJCgaXkq",846029560403648512
690,Sun Mar 26 10:04:13 +0000 2017,Alexander McQueen,In the atelier: Model fittings in Paris leading up to the SS17 catwalk show. Picture by Sir Don McCullin. #AlexanderMcQueen #SirDonMcCullin https://t.co/wA2VJ4CgkI,845939439402651648
691,Sat Mar 25 15:53:28 +0000 2017,Alexander McQueen,"Seen in @inthemixte , the Alexander McQueen SS17 embellished mesh top with jet beaded tassels and fringing. #AlexanderMcQueen #McQueenSS17 https://t.co/Hdcy7gmYfw",845664943190020096
692,Fri Mar 24 17:56:15 +0000 2017,Alexander McQueen,A #McQueenSS17 fishnet lace knit dress and jet beaded fringe jacket worn with a kilt over trousers. Explore: https://t.co/NJmZhRzcUF https://t.co/4ZW1SFHrYw,845333455118516225
693,Thu Mar 23 17:57:28 +0000 2017,Alexander McQueen,A fishnet lace knitted dress inspired by the fisherman's nets hung in Shetland harbours #McQueenSS17. Explore: https://t.co/xaNVSnduW6 https://t.co/Kp21uIljv9,844971371650265088
694,Wed Mar 22 17:28:44 +0000 2017,Alexander McQueen,The #McQueenSS17 floral engraved bell charm necklace. Explore #AlexanderMcQueen jewellery: https://t.co/fKTZBHbtPm https://t.co/fq1QvRC72U,844601751533764615
695,Wed Mar 22 12:46:10 +0000 2017,Alexander McQueen,#McQueenSS17 Celtic inspired bracelets with tiny bells in the #AlexanderMcQueen atelier. https://t.co/3LaGNAjlaj,844530644038402051
696,Mon Mar 20 18:58:23 +0000 2017,Alexander McQueen,CLOSE-UP: a Celtic inspired earring with island floral engravings. #McQueenSS17 #AlexanderMcQueen https://t.co/z4bIImHXGg,843899540449247233
697,Sun Mar 19 17:18:29 +0000 2017,Alexander McQueen,Fitting the finale dress for #McQueenSS17 in Paris. Photograph by #SirDonMcCullin . https://t.co/Zxwve9JQhi,843512007995351041
698,Sun Mar 19 10:08:14 +0000 2017,Alexander McQueen,At work on the silver wave sequin embroidered #McQueenSS17 finale dress in the atelier. Photograph by #SirDonMcCullin https://t.co/4K1hW7nHIt,843403734428385280
699,Sat Mar 18 09:27:36 +0000 2017,Alexander McQueen,In the atelier: embroidered details of the silver wave shipwreck dress for #McQueenSS17. Photography by #SirDonMcCullin https://t.co/udtq3gKGwe,843031120816095233
700,Fri Mar 17 18:37:32 +0000 2017,Alexander McQueen,"A #McQueenSS17 pieced and panelled leather corset with chain stitch, embroidery and beaded lace. Explore: https://t.co/y9Gnr3QzXF https://t.co/e4YggCLFKK",842807125894139905
701,Fri Mar 17 17:38:16 +0000 2017,Alexander McQueen,See @BrieLarson wearing a Pre AW17 Birdseye draped trouser suit to the ‘Kong: Skull Island’ press conference in Beijing. #SeenInMcQueen https://t.co/xRRgKY6lih,842792210676535297
702,Fri Mar 17 15:32:18 +0000 2017,Alexander McQueen,Hobnail boots from #McQueenSS17 with pieced and panelled floral embroidery. See more: https://t.co/bfLAo3ertB https://t.co/L3ijNzPmiA,842760513989808129
703,Thu Mar 16 18:37:27 +0000 2017,Alexander McQueen,Embroidered coastal flowers on denim for #McQueenSS17. Explore the collection: https://t.co/1cFhpRBlrM https://t.co/685JtR1mGb,842444720840298498
704,Wed Mar 15 18:53:18 +0000 2017,Alexander McQueen,A Fairisle knitted dress with a Celtic inspired studded belt and jewellery. Explore new #McQueenSS17 knitwear: https://t.co/JE4S0ccbKV https://t.co/mdKe2QzSJY,842086318926630912
705,Tue Mar 14 11:35:25 +0000 2017,Alexander McQueen,Explore dandified tailoring inspired by 60s London and opulent India: https://t.co/bxZyJeWBxv https://t.co/e9kBTrGYD8,841613735412269056
706,Sun Mar 12 12:26:08 +0000 2017,Alexander McQueen,Backstage at the #McQueenAW17 show at the Orangerie in Paris. Explore: https://t.co/zBzPYnYmUK https://t.co/DFgJkFkCej,840901721333387265
707,Sat Mar 11 18:17:13 +0000 2017,Alexander McQueen,Seen backstage: a biker jacket with stud and eyelet details. Explore the show https://t.co/zBzPYnYmUK https://t.co/azCQ8CSmca,840627688792559619
708,Fri Mar 10 18:12:42 +0000 2017,Alexander McQueen,The whipstitch fringe Box bag seen with stacked cuffs. Explore the show https://t.co/zBzPYnYmUK https://t.co/mDzJvWD2fM,840264161242296321
709,Fri Mar 10 11:07:40 +0000 2017,Alexander McQueen,Whipstitch lacing details inspired by Cornish cloutie trees. See more: https://t.co/zBzPYnYmUK #McQueenAW17 #AlexanderMcQueen #PFW https://t.co/T4w5jFIKgD,840157202073698304
710,Thu Mar 09 20:39:27 +0000 2017,Alexander McQueen,Lining up backstage in a whipstitch shearling coat worn over an asymmetric samplers embroidery dress. See more: https://t.co/zBzPYnYmUK https://t.co/RhUX8cMUVY,839938706496716801
711,Thu Mar 09 14:16:57 +0000 2017,Alexander McQueen,Backstage: an engineered cross stitch printed silk dress referencing kneelers stitched at St. Senara’s in Cornwall. https://t.co/zBzPYnYmUK https://t.co/ZWFk9kWuBg,839842446238441472
712,Thu Mar 09 08:58:11 +0000 2017,Alexander McQueen,In the atelier: cross stitch embroidery inspired by kneelers at St. Senara’s in Cornwall. See more: https://t.co/zBzPYnGLwa #McQueenAW17 https://t.co/2c5mv9zEm6,839762227766796288
713,Wed Mar 08 20:44:58 +0000 2017,Alexander McQueen,"RT @wmag: ""Women's rights are human rights."" @KendallJenner, @BellaHadid, and more share a message on #InternationalWomensDay: https://t.co…",839577705515462656
714,Wed Mar 08 17:30:33 +0000 2017,Alexander McQueen,A cashmere voile top inspired by medieval samplers created to practice different embroidery techniques and ideas. #McQueenAW17 #PFW https://t.co/MYvsWVEDwg,839528778044932096
715,Wed Mar 08 12:33:53 +0000 2017,Alexander McQueen,A Tree of Life embroidery dress worn with molten antique silver earrings with black portoro stones. #McQueenAW17 #AlexanderMcQueen #PFW https://t.co/QW4eZLsqKE,839454121962926080
716,Wed Mar 08 06:39:14 +0000 2017,Alexander McQueen,Backstage: the Magical Map embroidered dress inspired by old alchemy illustrations and druid symbols. #McQueenAW17 #AlexanderMcQueen #PFW https://t.co/2CYxkM6mpE,839364869187055616
717,Tue Mar 07 09:54:33 +0000 2017,Alexander McQueen,Highlights from the #McQueenAW17 show. See more: https://t.co/zBzPYnYmUK #PFW https://t.co/wQlFtn9ztT,839051636186222592
718,Tue Mar 07 00:29:54 +0000 2017,Alexander McQueen,"The finale dress tonight, embroidered with glass beads and stones, inspired by pagan wishing trees in Cornwall. #PFW #McQueenAW17 https://t.co/RJUH5i5lgz",838909537923002372
719,Mon Mar 06 22:22:05 +0000 2017,Alexander McQueen,A lattice embroidered dress with medieval inspired motifs photographed backstage at tonight’s AW17 show. #McQueenAW17 #PFW #AlexanderMcQueen https://t.co/mUiGB2wVgO,838877370702577664
720,Mon Mar 06 20:49:45 +0000 2017,Alexander McQueen,Backstage at tonight’s Autumn/Winter 2017 show: jacquard and brocade dresses with feather stitch details. #McQueenAW17 #PFW https://t.co/0cXyZawD8R,838854134824579074
721,Mon Mar 06 19:18:17 +0000 2017,Alexander McQueen,Close up: hair and make-up behind the scenes at the AW17 womenswear show. #McQueenAW17 #AlexanderMcQueen #PFW https://t.co/KPaF9rw7TV,838831115301441536
722,Mon Mar 06 18:35:15 +0000 2017,Alexander McQueen,About to begin. The Alexander McQueen Autumn/Winter 2017 show in the Luxembourg Gardens in Paris. #PFW #McQueenAW17 #AlexanderMcQueen https://t.co/OcUdnoqSbC,838820286644506624
723,Mon Mar 06 09:02:02 +0000 2017,Alexander McQueen,An etched portrait. The invitation to the Alexander McQueen Autumn/Winter 2017 womenswear show. Tonight at 8pm. #PFW #McQueenAW17 https://t.co/afLd3uI3ab,838676032861396992
724,Sun Mar 05 18:49:19 +0000 2017,Alexander McQueen,From the atelier: a detail from the Autumn/Winter 2017 collection before tomorrow’s show in Paris. #PFW #McQueenAW17 https://t.co/XUOznDEtyk,838461437345398784
725,Sun Mar 05 17:06:57 +0000 2017,Alexander McQueen,"Work in the #AlexanderMcQueen Paris atelier ahead of the #McQueenAW17 womenswear show tomorrow. See more: 
https://t.co/zBzPYnYmUK #PFW https://t.co/kDgDyUTJTp",838435679197622274
726,Sun Mar 05 09:15:03 +0000 2017,Alexander McQueen,See collection inspiration and more on #AlexanderMcQueen Instagram stories now. #PFW #McQueenAW17,838316920877289472
727,Thu Mar 02 22:03:26 +0000 2017,Alexander McQueen,In the atelier: a selection of Celtic inspired jewellery laid out for SS17 collection fittings. Photograph by Sir Don McCullin.#McQueenSS17 https://t.co/twhSNZt0bY,837423127923687424
728,Thu Mar 02 18:40:30 +0000 2017,Alexander McQueen,CLOSE-UP: Meticulous metalwork and detailed engraving. Explore the collection: https://t.co/u2xM0ddqQu #McQueenSS17 #SirDonMcCullin https://t.co/pTyFU1wFZY,837372057830719488
729,Thu Mar 02 18:17:10 +0000 2017,Alexander McQueen,Antique silver cuffs with Celtic inspired floral engravings are worn stacked on the wrists. Explore the collection: https://t.co/wKPGZfto6C https://t.co/EqsPMiTNAl,837366182256783360
730,Tue Feb 28 20:51:17 +0000 2017,Alexander McQueen,Antique silver &amp; gold earrings with Celtic inspired engravings worn with a bell charm necklace. Photograph by #SirDonMcCullin. #McQueenSS17 https://t.co/CxA0F4H7QL,836680192374550528
