,created,handle,text,tweet_id
0,Wed Mar 28 17:09:10 +0000 2018,Alexander McQueen,"A softly boned, deconstructed heirloom corset top in shredded floral jacquard, washed organza and embroidered silk tulle. From the Alexander McQueen Spring/Summer 2018 collection. Discover #McQueenSS18: https://t.co/e2rMxkBjRo https://t.co/Lc3XLmdtID",979042727542378499
1,Wed Mar 28 12:30:07 +0000 2018,Alexander McQueen,An Alexander McQueen Spring/Summer 2018 silver embroidered jacket is worn with a white knit dress and three-buckle boots. Discover #McQueenSS18: https://t.co/e2rMxkBjRo https://t.co/OBcNsJ3LYt,978972500787900416
2,Tue Mar 27 18:04:41 +0000 2018,Alexander McQueen,An exploded glass organza flower dress. From the Alexander McQueen Spring/Summer 2018 collection. Discover #McQueenSS18: https://t.co/e2rMxkBjRo https://t.co/AX7T1d4rBY,978694308428697600
3,Tue Mar 27 09:11:52 +0000 2018,Alexander McQueen,"An heirloom dress features hand-embroidered floral motifs, deconstructed sleeves and pompom trims. Discover #McQueenSS18: https://t.co/e2rMxkBjRo https://t.co/6lV44VvciM",978560222435401728
4,Mon Mar 26 18:23:57 +0000 2018,Alexander McQueen,An asymmetric ruffle jacket as seen on the Alexander McQueen Spring/Summer 2018 runway in Paris. Discover #McQueenSS18: https://t.co/e2rMxkBjRo https://t.co/0G8Jqwmsu4,978336772777267200
5,Mon Mar 26 09:12:26 +0000 2018,Alexander McQueen,"A lust red corset dress with an exploded ruffle flower skirt, from the Alexander McQueen Spring/Summer 2018 collection. Photographed by Sir Don McCullin. Discover #McQueenSS18: https://t.co/e2rMxkBjRo https://t.co/NRUibIyv27",978197978321178624
6,Sun Mar 25 19:25:50 +0000 2018,Alexander McQueen,An Alexander McQueen Pre-Autumn/Winter 2018 jewelled satchel in nightshade purple. #McQueenPreAW18 https://t.co/5yT551arLY,977989955283750912
7,Sun Mar 25 09:27:42 +0000 2018,Alexander McQueen,An Alexander McQueen Spring/Summer 2018 silver embroidered jacket is worn with a white knit dress with metal stud detailing. Discover #McQueenSS18: https://t.co/e2rMxkBjRo https://t.co/kFXGGVcwRv,977839433058803712
8,Sat Mar 24 16:15:53 +0000 2018,Alexander McQueen,An exploded glass organza flower dress from the Alexander McQueen Spring/Summer 2018 collection. Photographed during fittings in the Paris atelier. Discover #McQueenSS18: https://t.co/e2rMxkBjRo https://t.co/IREmmWayBB,977579764243451905
9,Sat Mar 24 10:47:44 +0000 2018,Alexander McQueen,"An heirloom dress features hand-embroidered floral motifs, deconstructed sleeves and pompom trims. From the Alexander McQueen Spring/Summer 2018 campaign. Video by Masha Vasyukova. Music by Ricardo Tobar. Discover #McQueenSS18: https://t.co/e2rMxkBjRo https://t.co/My4O8hSzlf",977497182805913600
10,Fri Mar 23 18:08:39 +0000 2018,Alexander McQueen,"As seen in @wkorea , an Alexander McQueen Spring/Summer 2018 jewelled heirloom embroidery Box Bag. Photographed by Chang Min Lee. #McQueenBoxBag #McQueenSS18 https://t.co/aJl0lRbjIS",977245758452838400
11,Fri Mar 23 09:56:41 +0000 2018,Alexander McQueen,An engineered fil coupé tweed dress from the Alexander McQueen Spring/Summer 2018 collection. Discover #McQueenSS18: https://t.co/e2rMxkBjRo https://t.co/rhccleow8N,977121950492393474
12,Thu Mar 22 17:57:27 +0000 2018,Alexander McQueen,"A perfecto jacket featuring check patchwork, gold plated metal hardware and free hanging straps. From the Alexander McQueen Spring/Summer 2018 collection. Explore #McQueenSS18: https://t.co/e2rMxkBjRo https://t.co/cmacxgApZ4",976880551457062912
13,Thu Mar 22 11:59:22 +0000 2018,Alexander McQueen,A cavalry twill cutaway riding jacket. From the Alexander McQueen Spring/Summer 2018 collection. Discover #McQueenSS18: https://t.co/e2rMxkBjRo https://t.co/sVISD2gI8e,976790435518611456
14,Wed Mar 21 18:07:10 +0000 2018,Alexander McQueen,An Alexander McQueen Spring/Summer 2018 chandelier earring in antique silver. Photograph by Sir Don McCullin. Discover #McQueenSS18: https://t.co/e2rMxkBjRo https://t.co/gHq8ZoVN0s,976520608065441792
15,Wed Mar 21 09:00:20 +0000 2018,Alexander McQueen,An Alexander McQueen cutaway cavalry twill riding coat is pieced with check patchwork inserts. From the Alexander McQueen Spring/Summer 2018 collection. Explore #McQueenSS18: https://t.co/e2rMxkBjRo https://t.co/uBPmso7r7X,976382993622237184
16,Tue Mar 20 15:21:56 +0000 2018,Alexander McQueen,The three-buckle boot features multi-coloured silk rosebuds inside a transparent block heel. Discover #McQueenSS18: https://t.co/e2rMxkBjRo https://t.co/uZM2OllFPZ,976116635957452800
17,Tue Mar 20 10:00:22 +0000 2018,Alexander McQueen,A charm necklace with baroque river pearls and crystal droplets. From the Alexander McQueen Spring/Summer 2018 collection. Photograph by Sir Don McCullin. Discover #McQueenSS18: https://t.co/e2rMxkBjRo https://t.co/rDcwcX6x1o,976035713451003904
18,Mon Mar 19 20:35:40 +0000 2018,Alexander McQueen,In the atelier: the Alexander McQueen bespoke bordeaux wool silk jacket with silver embroidered cuffs worn by @Harry_Styles on tour in Antwerp. #SeeninMcQueen #HarryStyles #LiveOnTour #AlexanderMcQueen https://t.co/pyxmGZw9Nj,975833203289321472
19,Mon Mar 19 18:30:03 +0000 2018,Alexander McQueen,See @Harry_Styles wearing an Alexander McQueen bespoke bordeaux wool silk jacket with silver embroidered cuff and hem details to his Live on Tour concert in Antwerp. #SeeninMcQueen #HarryStyles #LiveOnTour #AlexanderMcQueen https://t.co/CEKqjhibQE,975801592862707713
20,Mon Mar 19 14:59:22 +0000 2018,Alexander McQueen,A deconstructed couture dress with trailing garden flowers is fitted in Paris before the Alexander McQueen Spring/Summer 2018 show. Photograph by Sir Don McCullin. Explore #McQueenSS18: https://t.co/e2rMxkBjRo https://t.co/dNKmRh4Wmt,975748569448763393
21,Mon Mar 19 09:53:45 +0000 2018,Alexander McQueen,Geometric structures are topped with transparent tulle canopies that become increasingly overgrown with intricately embroidered flowers. Created in the atelier in Paris for the Alexander McQueen Spring/Summer 2018 runway show. Discover #McQueenSS18: https://t.co/e2rMxkBjRo https://t.co/uXp8bCVUHx,975671658206912514
22,Sun Mar 18 17:22:59 +0000 2018,Alexander McQueen,A deconstructed corset dress with trailing garden flower embroideries is created in the atelier in Paris. From the Alexander McQueen Spring/Summer 2018 collection. Explore #McQueenSS18: https://t.co/e2rMxkBjRo https://t.co/27h4TVP2SX,975422327176466433
23,Sun Mar 18 12:11:57 +0000 2018,Alexander McQueen,An Alexander McQueen pieced and patched denim skirt with an antique floral handkerchief hem and harness tapestry top with embroidered garden roses. From the Alexander McQueen Spring/Summer 2018 collection. Discover #McQueenSS18: https://t.co/e2rMxkBjRo https://t.co/7UTppjOvIc,975344051934433281
24,Sun Mar 18 00:37:40 +0000 2018,Alexander McQueen,A ruffle hem jacket in light wool silk with silk faille detailing is worn with a silver jewelled case clutch and embellished three-buckle boots. From the Alexander McQueen Spring/Summer 2018 collection. Explore #McQueenSS18: https://t.co/e2rMxkBjRo https://t.co/UOSqUA7vVt,975169329313603584
25,Sat Mar 17 09:08:34 +0000 2018,Alexander McQueen,A black silk shawl with skull and garden treasure motifs. From the Alexander McQueen Spring/Summer 2018 collection. Discover #McQueenSS18: https://t.co/e2rMxkBjRo https://t.co/c2wYMx8Urd,974935513055547392
26,Fri Mar 16 15:26:24 +0000 2018,Alexander McQueen,A harness tapestry top with embroidered garden roses is created in the atelier. From the Alexander McQueen Spring/Summer 2018 collection. Explore #McQueenSS18: https://t.co/e2rMxkBjRo https://t.co/QOxxmqJIHN,974668212595019776
27,Fri Mar 16 09:49:45 +0000 2018,Alexander McQueen,An engineered fil coupé dégradé tweed dress from the Alexander McQueen Spring/Summer 2018 collection is fitted in the atelier. Photograph by Sir Don McCullin. Discover #McQueenSS18: https://t.co/e2rMxkBjRo https://t.co/eehzZ4R9eU,974583490527318016
28,Thu Mar 15 14:06:54 +0000 2018,Alexander McQueen,An Alexander McQueen Spring/Summer 2018 jacket with a contrasting bird-sketch print embroidery. Explore #McQueenSS18: https://t.co/e2rMxkBjRo https://t.co/hUXm83svo3,974285815890284546
29,Thu Mar 15 10:29:41 +0000 2018,Alexander McQueen,A deconstructed corset dress with trailing garden flower embroideries is fitted in the Paris atelier in the days before the Alexander McQueen Spring/Summer 2018 show. Photograph by Sir Don McCullin. Discover #McQueenSS18: https://t.co/e2rMxkBjRo https://t.co/CGVJe3DLVZ,974231150293118976
30,Wed Mar 14 14:36:12 +0000 2018,Alexander McQueen,"Three-buckle boots embellished with heirloom treasure motifs: a fan, rose, floral locket and flowers in a mix of green, red and fuchsia. From the Alexander McQueen Spring/Summer 2018 collection. Explore #McQueenSS18: https://t.co/e2rMxkBjRo https://t.co/9fBdyn0CzF",973930801556606976
31,Wed Mar 14 09:45:16 +0000 2018,Alexander McQueen,A lust red corset dress with an exploded ruffle flower skirt is fitted in the atelier in Paris before the Alexander McQueen Spring/Summer 2018 show. Photograph by Sir Don McCullin. Discover #McQueenSS18: https://t.co/e2rMxkBjRo https://t.co/CD2sxEZ5DF,973857583835631616
32,Tue Mar 13 15:53:07 +0000 2018,Alexander McQueen,Backstage at the Alexander McQueen Spring/Summer 2018 show: a multi-earring and beaded choker with crystals and river pearls. Explore #McQueenSS18: https://t.co/e2rMxkBjRo https://t.co/WAz56Nm8Ei,973587769233756160
33,Tue Mar 13 09:51:26 +0000 2018,Alexander McQueen,An oversized trench coat is pieced and panelled with floral jacquards and belted at the waist. From the Alexander McQueen Spring/Summer 2018 collection. Discover #McQueenSS18: https://t.co/e2rMxkBjRo https://t.co/1pDIcKfsVd,973496748420280320
34,Mon Mar 12 15:41:04 +0000 2018,Alexander McQueen,"A quilted black patent Box Bag with lust red stitching and a jewelled chain strap with charms, crystal and pearl embellishments. From the Alexander McQueen Spring/Summer 2018 collection. Explore #McQueenSS18: https://t.co/e2rMxkBjRo https://t.co/y2HdQw4U5k",973222348710129666
35,Mon Mar 12 09:57:05 +0000 2018,Alexander McQueen,A pale pink taffeta dress with embroidered trailing three-dimensional flowers. Photographed by Sir Don McCullin during fittings for the Alexander McQueen Spring/Summer 2018 show. Explore #McQueenSS18: https://t.co/e2rMxkBjRo https://t.co/Z6i3MT3quT,973135783195537408
36,Sun Mar 11 17:39:11 +0000 2018,Alexander McQueen,A chandelier earring in antique gold is laid out in preparation for the Alexander McQueen Spring/Summer 2018 show in Paris. Explore #McQueenSS18: https://t.co/e2rMxkBjRo https://t.co/shCfHM853Y,972889686342545410
37,Sun Mar 11 11:22:04 +0000 2018,Alexander McQueen,A lust red corset dress with an exploded ruffle flower skirt. From the Alexander McQueen Spring/Summer 2018 collection. Discover #McQueenSS18: https://t.co/e2rMxkBjRo https://t.co/Yu6WWmSM8X,972794781599522822
38,Sat Mar 10 15:41:58 +0000 2018,Alexander McQueen,"Filmed backstage at the Autumn/Winter 2018 womenswear show in Paris, a video by Masha Vasyukova. #McQueenAW18 #PFW https://t.co/1ZMLLslXc2",972497802583560199
39,Fri Mar 09 19:01:05 +0000 2018,Alexander McQueen,A floating butterfly dress in flamingo pink with a voluminous billowing train. Explore #McQueenAW18: https://t.co/NreYqPRQMi https://t.co/EqWoXUaT7j,972185521471606786
40,Fri Mar 09 16:49:10 +0000 2018,Alexander McQueen,A black wool silk tuxedo dress with contrast ruffles in flamingo pink taffeta. Discover #McQueenAW18: https://t.co/NreYqPRQMi https://t.co/fCU2tR8MsI,972152323630878721
41,Fri Mar 09 15:48:59 +0000 2018,Alexander McQueen,An exploded scale beetle jacquard coat is graphically woven in velvet and silk yarns. The mirrored placement of the woven velvet jacquard is engineered to the coat panels and reflects the natural symmetry and graphic patterns of a beetle’s shell. Explore: https://t.co/NreYqPRQMi https://t.co/j4zsvFC7S2,972137179118960646
42,Fri Mar 09 13:53:30 +0000 2018,Alexander McQueen,An engineered hanging thread embroidered top is inspired by birds of paradise and Painted Lady butterfly wings. See more from #McQueenAW18: https://t.co/NreYqPRQMi https://t.co/hdey54OGdD,972108114731335680
43,Fri Mar 09 11:43:30 +0000 2018,Alexander McQueen,A draped silk satin dress in a kaleidoscopic print of mirrored Painted Lady butterfly wings. Explore #McQueenAW18: https://t.co/NreYqPRQMi https://t.co/iQjCvj3boZ,972075398975586304
44,Thu Mar 08 19:07:38 +0000 2018,Alexander McQueen,A three-dimensional embroidered cape features black round sequins with a dégradé into long spikey black sequins of increasing lengths to create a magnified beetle motif. Explore #McQueenAW18: https://t.co/NreYqPRQMi https://t.co/qXyL9QmDfG,971824781950636035
45,Thu Mar 08 16:21:04 +0000 2018,Alexander McQueen,An engineered ribbed and laddered knit with graphic colour blocking using an intarsia technique and pieced together with metal eyelets. See more: https://t.co/NreYqPRQMi https://t.co/xegO2Dbstm,971782865708044288
46,Thu Mar 08 14:17:48 +0000 2018,Alexander McQueen,A military inspired sweeping cape tailored from soft black cashmere blanket and graphically edged in bold deep red military stripes. Discover #McQueenAW18: https://t.co/NreYqPRQMi https://t.co/2ftDHHe7JG,971751845843603456
47,Thu Mar 08 11:40:44 +0000 2018,Alexander McQueen,"An intricate silver hand-embroidered dress is composed of a range of exotic beetle motifs in metallic silver and light gold, red, black orange and yellow. Explore #McQueenAW18: https://t.co/NreYqPRQMi https://t.co/AyK10szMqz",971712318739447809
48,Thu Mar 08 09:44:44 +0000 2018,Alexander McQueen,A military inspired deconstructed jacket and kickback trousers are pieced and patched in a bottle green cotton canvas and worn with polished sculpted riding boots. Explore #McQueenAW18: https://t.co/NreYqPRQMi https://t.co/Jzer5z3ICJ,971683124127129601
49,Wed Mar 07 21:12:07 +0000 2018,Alexander McQueen,A double silk duchess butterfly bow tuxedo jacket is draped and wrapped like a chrysalis. Discover the #McQueenAW18 collection: https://t.co/NreYqPRQMi https://t.co/JoWJOc2hxY,971493720947412992
50,Wed Mar 07 15:36:44 +0000 2018,Alexander McQueen,Exploded beetle and butterfly wing designs are photographed backstage at the Alexander McQueen Autumn/Winter 2018 show. Explore #McQueenAW18: https://t.co/NreYqPRQMi https://t.co/0dj9nzz42p,971409322256330752
51,Wed Mar 07 14:06:35 +0000 2018,Alexander McQueen,"A tailored deconstructed wool and silk jacket with satin tuxedo details is draped at the hem with a graphic and mirrored Painted Lady Butterfly satin scarf, softly belted with a languid fringed belt and trailing sleeves. Explore: https://t.co/NreYqPRQMi https://t.co/7Z3oTaB2Gb",971386631763779587
52,Wed Mar 07 12:35:37 +0000 2018,Alexander McQueen,"Lace panelled tailoring and a floating, draped, double silk satin scarf dress are seen backstage at the Alexander McQueen Autumn/Winter 2018 show. Discover: https://t.co/NreYqPRQMi https://t.co/sjFvHWQJ2n",971363740057731073
53,Wed Mar 07 12:33:06 +0000 2018,Alexander McQueen,An articulated bodice with butterfly panelling is worn with a pink morpho butterfly skirt. See more: https://t.co/NreYqPRQMi https://t.co/VH6pzFs7Qq,971363108051709953
54,Tue Mar 06 21:11:58 +0000 2018,Alexander McQueen,"A dress inspired by oversized butterfly wings. The graphic, colourful wings are created with appliqued hand-dyed creponne, satin stitch, loose textured stitching, tufting and long fringes. Explore #McQueenAW18: https://t.co/NreYqPRQMi https://t.co/V4g8872pSo",971131294636703745
55,Tue Mar 06 19:58:42 +0000 2018,Alexander McQueen,A draped wool silk tuxedo double-breasted coat has cut-away corset panels in sarabande lace. Discover #McQueenAW18: https://t.co/NreYqPRQMi https://t.co/puYObASbF7,971112859420823554
56,Tue Mar 06 19:41:46 +0000 2018,Alexander McQueen,"A black articulated beetle inspired bodice is worn with a tulle skirt embroidered with exotic beetles, butterfly and dragonfly motifs in black, blues, greens, yellows, reds, purples, ivory and gold. Discover #McQueenAW18: https://t.co/NreYqPRQMi https://t.co/ILOt704owC",971108594891489287
57,Tue Mar 06 17:08:12 +0000 2018,Alexander McQueen,A military inspired drape cashmere blanket coat with a jacquard red stripe is worn with a red and black Pin Satchel. Discover #McQueenAW18: https://t.co/NreYqPRQMi https://t.co/zEz4YJs6g0,971069952001273856
58,Tue Mar 06 16:45:57 +0000 2018,Alexander McQueen,A velvet fil coupé jacquard coat with the mirrored patterns and symmetrical markings of a softly dusted butterfly wing. Explore #McQueenAW18: https://t.co/NreYqPRQMi https://t.co/slzhxg2pX5,971064351837827074
59,Tue Mar 06 14:21:53 +0000 2018,Alexander McQueen,An articulated beetle inspired bodice in flamingo pink and carmin red is worn with a knit skirt with graphic lines. Explore #McQueenAW18: https://t.co/NreYqPRQMi https://t.co/QWFaqVNXsS,971028094411853825
60,Tue Mar 06 13:20:57 +0000 2018,Alexander McQueen,Highlights from the Alexander McQueen Autumn/Winter 2018 womenswear show. Watch the full film: https://t.co/NreYqPRQMi #McQueenAW18 https://t.co/ew4cvYC47O,971012761458274304
61,Tue Mar 06 01:23:03 +0000 2018,Alexander McQueen,Looks inspired by the magnified markings of Goliath beetles. Photographed backstage at the #McQueenAW18 show. See more: https://t.co/NreYqPRQMi #PFW https://t.co/UeSskeXp1l,970832097249284096
62,Tue Mar 06 00:30:38 +0000 2018,Alexander McQueen,"Kaleidoscopic exploded butterfly wing designs, seen backstage at the Autumn/Winter 2018 show tonight in Paris. Explore: https://t.co/NreYqPRQMi https://t.co/Fhpuzmw3uo",970818903147515907
63,Mon Mar 05 23:40:48 +0000 2018,Alexander McQueen,Magnified beetle prints. Photographed backstage at tonight’s Autumn/Winter 2018 show in Paris. #McQueenAW18 #PFW https://t.co/OLBXWEUEb4,970806365441724416
64,Mon Mar 05 19:01:45 +0000 2018,Alexander McQueen,Minutes before the Alexander McQueen Autumn/Winter 2018 womenswear show in Paris tonight. #McQueenAW18 #PFW https://t.co/mMHeYK52M1,970736139454861313
65,Mon Mar 05 13:50:55 +0000 2018,Alexander McQueen,"The #McQueenAW18 womenswear show, tonight in Paris at 8PM CET. 
#McQueenAW18 #AlexanderMcQueen #PFW https://t.co/96dXlQz55G",970657913982390272
66,Mon Mar 05 11:46:55 +0000 2018,Alexander McQueen,A detail from the dress worn by #EmilyBlunt to last night’s Vanity Fair Oscar Party. Art nouveau flower and bird embroidery is created with gold sequins and silver beaded outlines. #SeenInMcQueen #McQueenDetail https://t.co/88Of7KfN12,970626710319370240
67,Mon Mar 05 10:50:54 +0000 2018,Alexander McQueen,See #EmilyBlunt at the Vanity Fair Oscar party wearing an Alexander McQueen art nouveau gold embroidered tulle dress. #Oscars2018 #Oscars #VanityFairParty #VFOscars #SeenInMcQueen https://t.co/zy7TUqWFGg,970612614156910592
68,Sun Mar 04 17:44:04 +0000 2018,Alexander McQueen,Close-up: work in the atelier before tomorrow’s #McQueenAW18 womenswear show. See more: https://t.co/2u8TCitQjG #PFW https://t.co/rGw7x6qYpd,970354200155738113
69,Sun Mar 04 15:02:42 +0000 2018,Alexander McQueen,The Alexander McQueen Autumn/Winter 2018 show. Tomorrow at 8pm in Paris. See more: https://t.co/2u8TCitQjG #McQueenAW18 #PFW https://t.co/Cc9brlekyH,970313590430404611
70,Sun Mar 04 12:14:02 +0000 2018,Alexander McQueen,In the atelier: a detail from the #McQueenAW18 collection before the show tomorrow in Paris. See more: https://t.co/2u8TCitQjG #PFW https://t.co/dCYv92AAYi,970271144828919808
71,Sat Mar 03 16:23:54 +0000 2018,Alexander McQueen,"The Alexander McQueen Autumn/Winter 2018 womenswear show, Monday at 8pm CET. Discover: https://t.co/2u8TCitQjG #McQueenAW18 #PFW https://t.co/aCXKghMAeo",969971639902498816
72,Sat Mar 03 14:04:36 +0000 2018,Alexander McQueen,"The Alexander McQueen Autumn/Winter 2018 womenswear show, Monday at 8pm CET. Discover: https://t.co/2u8TCitQjG #McQueenAW18 #PFW https://t.co/RuhZ9P9Ryu",969936583163023365
73,Sat Mar 03 10:19:33 +0000 2018,Alexander McQueen,"The Alexander McQueen Autumn/Winter 2018 womenswear show, Monday at 8pm CET. #McQueenAW18 #PFW https://t.co/3FyZPq2wZj",969879948621238273
74,Thu Mar 01 18:05:36 +0000 2018,Alexander McQueen,Deconstructed dresses with trailing garden flower embroideries are photographed in the atelier in London. From the Alexander McQueen Spring/Summer 2018 collection. Explore #McQueenSS18: https://t.co/e2rMxkBjRo https://t.co/CLsuMw2XbJ,969272455650004993
75,Thu Mar 01 18:04:33 +0000 2018,Alexander McQueen,"A deconstructed heirloom corset top in shredded floral jacquard, washed organza and embroidered silk tulle. From the Alexander McQueen Spring/Summer 2018 collection. Explore #McQueenSS18: https://t.co/e2rMxkBjRo https://t.co/cmh5yfGiof",969272193803849728
76,Wed Feb 28 22:14:46 +0000 2018,Alexander McQueen,"IN DETAIL: A red fil coupé degradé tweed dress is worn with a jewelled metal cuff with crystals, pearls and snake detailing. Explore #McQueenSS18: https://t.co/e2rMxkBjRo https://t.co/0hzpuFj2Db",968972773367402496
77,Wed Feb 28 19:04:34 +0000 2018,Alexander McQueen,"A deconstructed heirloom corset top in shredded floral jacquard, washed organza and embroidered silk tulle. Photographed by Sir Don McCullin during fittings in the Paris atelier. Explore #McQueenSS18: https://t.co/e2rMxkBjRo https://t.co/T5vFK50HSX",968924907236151296
78,Tue Feb 27 22:59:59 +0000 2018,Alexander McQueen,"A softly boned, deconstructed heirloom corset top in shredded floral jacquard, washed organza and embroidered silk tulle. From the #McQueenSS18 collection. See more: https://t.co/e2rMxkBjRo https://t.co/tl197a4qPK",968621764090744832
79,Tue Feb 27 18:55:52 +0000 2018,Alexander McQueen,A fil coupé degradé tweed dress from the #McQueenSS18 collection. Shot on the runway in Paris. See more: https://t.co/e2rMxkBjRo https://t.co/Wzpks6Tj8z,968560329809629184
80,Mon Feb 26 16:59:49 +0000 2018,Alexander McQueen,A high-waisted lust red ruffle knit dress. From the Alexander McQueen Spring/Summer 2018 campaign. Video by Masha Vasyukova. Music by Ricardo Tobar. Explore #McQueenSS18: https://t.co/e2rMxkBjRo https://t.co/cVwWGM4LCQ,968168739433861120
81,Mon Feb 26 10:57:45 +0000 2018,Alexander McQueen,"An heirloom dress featuring hand-embroidered floral motifs, deconstructed sleeves and pompom trims is inspired by haute couture passed down through generations. From the Alexander McQueen Spring/Summer 2018 collection. Explore #McQueenSS18: https://t.co/e2rMxkSUIW https://t.co/TZbIyKe8h7",968077620121227264
82,Sun Feb 25 18:59:40 +0000 2018,Alexander McQueen,"As seen in @mixte_paris, #ClaraLuciani wears an Alexander McQueen Spring/Summer 2018 wool silk tuxedo jacket with exploded rose taffeta sleeves and black kickback tuxedo trousers. Photographed by @laragiliberto Styled by #LoycFalque https://t.co/uMor4wffr1",967836511025627137
83,Sun Feb 25 13:39:47 +0000 2018,Alexander McQueen,An asymmetric ruffle jacket with exploded rose is photographed in the atelier in London. From the Alexander McQueen Spring/Summer 2018 collection. Explore #McQueenSS18: https://t.co/e2rMxkBjRo https://t.co/pWxCDmyVB9,967756009417707520
84,Sat Feb 24 14:28:33 +0000 2018,Alexander McQueen,A ruffle lace knit dress is cut away at the waistline. From the Alexander McQueen Spring/Summer 2018 collection. Explore #McQueenSS18: https://t.co/e2rMxkBjRo https://t.co/yFBXEE5iMR,967405894077214723
85,Sat Feb 24 10:35:15 +0000 2018,Alexander McQueen,"As seen in @TeleFashion , #OlympiaCampbell wears an Alexander McQueen Spring/Summer 2018 deconstructed vintage denim jacket, a pieced and patched denim skirt with an antique floral handkerchief hem and the three-buckle boots. Photographed by #NickDorey Styled by #MayaZepinic https://t.co/UwzvmmeP3I",967347182008504320
86,Fri Feb 23 11:32:17 +0000 2018,Alexander McQueen,In detail: Three-dimensional trailing blooms are embroidered across a silk taffeta gown. From the Alexander McQueen Spring/Summer 2018 collection. Explore #McQueenSS18 : https://t.co/e2rMxkBjRo https://t.co/2P0dqCKJwl,966999149718704128
87,Fri Feb 23 10:53:56 +0000 2018,Alexander McQueen,A trench coat pieced and patched with rosebud silk jacquards is inspired by interiors: from wallpaper to mattress quilting. From the Alexander McQueen Spring/Summer 2018 collection. Discover #McQueenSS18 : https://t.co/e2rMxkBjRo https://t.co/Bcna0bvdf3,966989495559249920
88,Thu Feb 22 10:00:24 +0000 2018,Alexander McQueen,Discover the Spring/Summer 2018 collection in store and at https://t.co/USeWZJ4XwY Explore #McQueenSS18 : https://t.co/e2rMxkBjRo https://t.co/Anbkrzu7fL,966613636834787328
89,Wed Feb 21 17:23:27 +0000 2018,Alexander McQueen,"An Alexander McQueen Spring/Summer 2018 charm necklace is finished with horseshoes, cockerels, ivy leaves and teardrop pearls. Photograph by Sir Don McCullin. Explore #McQueenSS18 : https://t.co/e2rMxkBjRo https://t.co/jPlrL2KF0B",966362746307702784
90,Wed Feb 21 09:51:40 +0000 2018,Alexander McQueen,A deconstructed top is embroidered with trailing three-dimensional blooms. Filmed for the Alexander McQueen Spring/Summer 2018 campaign. Video by Masha Vasyukova. Explore #McQueenSS18 : https://t.co/e2rMxkBjRo https://t.co/lTbDuzQUGG,966249053280448512
91,Mon Feb 19 16:53:33 +0000 2018,Alexander McQueen,A signature slash-waist peplum jacket is corseted and finished with studs and hook-and-eye detailing. From the Alexander McQueen Spring/Summer 2018 collection. Explore #McQueenSS18 : https://t.co/e2rMxkBjRo https://t.co/LLTsJTRdsn,965630443906326528
92,Mon Feb 19 09:43:13 +0000 2018,Alexander McQueen,Three-buckle boots have crystal embellishment contained inside a transparent block heel. From the Alexander McQueen Spring/Summer 2018 collection. Discover #McQueenSS18 : https://t.co/e2rMxkBjRo https://t.co/PlDN0i23cU,965522149200089088
